,id,text,is_humor,humor_rating,humor_controversy,offense_rating
3906,3907,body templ peopl low head cross see,1,2.18,0.0,0.1
3907,3908,phon christian radio stat request highway hel,1,2.63,0.0,0.9
3908,3909,congr hugo fernandez gre lakesnavy er bow expert batm self mad cardboard util belt,1,0.87,1.0,0.25
3909,3910,scotsm wear kilt sheep hear zip mil away,1,2.53,1.0,1.2
3910,3911,prison may on word oth whol send,1,2.83,0.0,0.45
3911,3912,today church lady next light cigaret start smok almost drop beer shock,1,2.58,1.0,0.2
3912,3913,irishm apply job blacksmith blacksmi ask ev sho hors ir man reply tell donkey fuck,1,2.75,0.0,0.3
3913,3914,gaz lov ey think rememb contract oblig lex continu redefin luxury year year,1,2.05,1.0,0.25
3914,3915,psalm 612 heart overwhelm lead rock high pray las vega,0,,,0.05
3915,3916,blond mak good cowgirl keep calv togeth,1,1.7,0.0,2.3
3916,3917,midst mak end meet forget day meet end,0,,,0.0
3917,3918,could list on alb rest lif would prob wond kind fasc regim liv,1,2.76,0.0,0.5
3918,3919,nee see lov on help,0,,,0.2
3919,3920,tea rich peopl buy property,1,2.35,1.0,0.35
3920,3921,whatev mak mad leav whatev mak smil keep,0,,,0.15
3921,3922,lif hack us waterproof mascar run cry wif yel catch put mak,1,1.95,0.0,0.4
3922,3923,recov alcohol mean hungov,1,2.85,1.0,0.55
3923,3924,surround peopl exact want,0,,,0.0
3924,3925,tru hon talk gen wild unus bril sweet com art,0,,,0.0
3925,3926,cal muslim stand two build al,1,1.3,0.0,2.6
3926,3927,get rid garl brea eat appl drink green tea,0,,,0.0
3927,3928,sleep beauty syndrom extrem rar disord caus peopl sleep day week tim person wak episod may ent childlik stat confus real dream,0,,,0.0
3928,3929,don org dea mean someth,0,,,0.0
3929,3930,want go somewh fre win heck ye don pick sunday 8am get trick go church,1,2.53,1.0,0.25
3930,3931,surpr put pen elect socket shock,1,2.45,1.0,0.65
3931,3932,tot amount money ow every person country world 215 tril 2020 approxim 37 tril circ,0,,,0.0
3932,3933,many germ tak chang lightbulb on efficy peopl funny,1,1.8,1.0,1.35
3933,3934,group chubby newborn cal heavy infantry,1,2.8,1.0,0.2
3934,3935,hous wear address,1,2.55,0.0,0.0
3935,3936,delight annount 6k 6 day campaign success 6 day rais 8000 thank const show us pow commun beauty way start prid mon thank help us continu fee black tran folx,0,,,0.6
3936,3937,imagin lam drag drag rac would without contribut tran perform,0,,,0.4
3937,3938,class yellow mustard on healthiest condy world contain fat cholesterol carbohydr low amount sod pack heal benefit,0,,,0.15
3938,3939,collect 5 bil car destroy cal duty play,0,,,0.0
3939,3940,get combin 99 lesb polit 100 peopl dick,1,2.8,0.0,1.85
3940,3941,ant greek us ol oil sunscreen,0,,,0.0
3941,3942,ohan mean famy famy mean nobody get leave behind forget lilo stitch,0,,,0.0
3942,3943,ment il noth asham stigm bia sham us bil clinton,0,,,0.1
3943,3944,job 500 peopl sec guard cemetery,1,2.7,1.0,0.2
3944,3945,grenad girlfriend simil good on blow real wel,1,2.1,0.0,2.9
3945,3946,fak friend believ rum real friend believ,0,,,0.0
3946,3947,get littl tir peopl com door tel nee sav burn stupid firefight,1,3.05,0.0,0.65
3947,3948,ide die hono know al bury,1,2.8,1.0,1.2
3948,3949,peanutlov eleph myth eleph eat peanut wild eleph ev seem lik,0,,,0.0
3949,3950,girlfriend ruth fel back bik rod ruthless,1,3.05,1.0,0.1
3950,3951,wom tak grant lif bitch batm return,0,,,0.4
3951,3952,cury paradox acceiv chang carl rog,0,,,0.0
3952,3953,green tea antibact antiinflam property attack acn bacter reduc swel red acn heal,0,,,0.0
3953,3954,wond scarlet johansson ev fantas fat com book nerd oneway street,1,1.95,1.0,1.15
3954,3955,ment heal quest attempt answ find answ,0,,,0.0
3955,3956,best thing black list aw dad jok sorry,1,1.9,0.0,3.45
3956,3957,kortney dat produc film black tran expery sint develop resourc opportun tran men thrive yet work feel contin shun widerwhit tran commun,0,,,0.0
3957,3958,grat mean recogn 4 apprecy smal vict admir struggle tak simply b hum,0,,,0.0
3958,3959,tru nev dimin bas numb peopl choos believ,0,,,0.0
3959,3960,exw deaf leave deaf friend honest see sign,1,3.1,0.0,0.4
3960,3961,shout peopl ask opposit,1,2.35,1.0,0.0
3961,3962,band 80s cal prev bet cur,1,2.32,0.0,0.0
3962,3963,2011 queen elizabe ii agree act jam bond skit daniel craig olymp break roy protocol ask want speak part reply cours must say someth com rescu,1,2.0,0.0,0.0
3963,3964,baby gend rev party instead pink blu cak giant cak mal fem stripper jump,1,2.17,0.0,0.75
3964,3965,son ask dad condom us us avoid answ quest lik,1,3.2,0.0,0.3
3965,3966,pres someon fact contradict perceiv view world oft result backfir effect rath admit wrong invest gre believ unrely inform,0,,,0.0
3966,3967,lose electron real get keep ion,1,2.32,0.0,0.0
3967,3968,giv straight doc nev walk giv gay nev stroll merry boardwalk,1,2.28,1.0,1.55
3968,3969,sad craigsl ad seek second third 3way,1,2.47,0.0,0.5
3969,3970,grenad wom common remov ring whol hous gon,1,3.1,0.0,1.1
3970,3971,crazy party girl thing crap every girl climb tabl think hottest girl real dant alon,0,,,0.35
3971,3972,think hypochondr turn head,1,2.0,0.0,0.45
3972,3973,guess nee marry counsel lov darl stand queen sug,0,,,0.3
3973,3974,kimb seltz styl expert men help men cloth also get heart mat start insid work way episod learn exud mass confid charism 7 second,0,,,0.0
3974,3975,wif urg expery bedroom guess expect would dissect many whit mic,1,2.53,1.0,0.05
3975,3976,peopl say back head look real nic see,1,2.74,0.0,0.0
3976,3977,muslim eat thanksg quranberry,1,2.0,0.0,1.45
3977,3978,diff aceton hitl on us remov pol us remov pol,1,2.3,0.0,3.2
3978,3979,friend half ind ian,1,2.12,0.0,0.65
3979,3980,meet girl club night tell would show good tim get outsid run 40 yard dash 48 second,1,2.5,1.0,0.15
3980,3981,chin man nee tak dog ov mit,1,1.6,1.0,3.6
3981,3982,bumbleb tru commun dant whit on suppos,1,1.74,0.0,1.3
3982,3983,transvestit alway angry crossdress,1,1.4,0.0,1.9
3983,3984,watermelon 91 wat,0,,,0.0
3984,3985,fyi duc duc tap short tap intend purpos abduc peopl,1,2.22,1.0,1.05
3985,3986,eat dat day help fight constip intestin disord weight gain heart problem sex weak abdomin cant,0,,,0.0
3986,3987,word inf origin latin word inf mean un talk speechless,0,,,0.1
3987,3988,risk gre second stop push someth terr hap someth nev see com,0,,,0.0
3988,3989,muslim good driv night brak fast,1,2.1,1.0,0.75
3989,3990,fresh start cle slat world poss mat new adv embark stil,0,,,0.2
3990,3991,doct ask drink excess tell drink anyth,1,2.8,1.0,0.0
3991,3992,ten tim every ken burn doc nar say someth lik wizzy galoot know far wid christian skip best dant city ag 16 trampl fath dea keep piec man skul pocket good luck,0,,,0.6
3992,3993,hardest decid mak midnight new year ev room hous want hide cry,1,2.12,0.0,0.0
3993,3994,hard watch wif pun kid find horsy draw wal crayon good job par heart tel draw,1,2.29,1.0,0.35
3994,3995,bk sswimmeetsaturdays win edward rosemond grac brookwood girl school thank play see next weekend,0,,,0.0
3995,3996,say 1 4 men homosex must on group friend hop david sup cut,1,3.17,1.0,0.55
3996,3997,could hel kel driv wom,1,2.1,1.0,3.2
3997,3998,beekeep say go work alright let us get beeswax,1,1.95,0.0,0.0
3998,3999,germ conqu poland fast march backward pol think leav,1,2.1,1.0,1.15
3999,4000,ask wif marry say real funny say think good bed say see hil,1,3.1,1.0,0.0
4000,4001,gav friend eleph room say thank say ment,1,2.71,1.0,0.0
4001,4002,jehovah wit knock door today invit gav tea biscuit say jehovah wit thing get fuck clu reply nev get far,1,2.85,0.0,1.2
4002,4003,dog oft sneez let hum dog know friend play rough turn fight know calm sign intern dog day,0,,,0.0
4003,4004,shap lif around fal apart ev surv kind pain los lov lik org dam,0,,,0.0
4004,4005,writ todo list send mot subconscy mind guid act achiev get mot,0,,,0.0
4005,4006,play chess friend say let us mak thing interest stop play chess,1,3.1,0.0,0.15
4006,4007,want forev forev alway good bad ug grow old togeth forev alway parachut,0,,,0.0
4007,4008,screw afr wom last night keep yel n word real hard cont scream entir tim,1,1.72,0.0,4.15
4008,4009,sev ev od,1,2.37,0.0,0.0
4009,4010,gummy bear delicy wif dai vitamin hold couch head on arm find remot,1,2.05,0.0,0.0
4010,4011,know much much much soontoo much funtoo much lovetoo much askand much bear,0,,,0.0
4011,4012,fin light skil abysm know wheth want llc scorp someon help,0,,,0.0
4012,4013,cow giv milk ud fail,1,2.55,1.0,0.15
4013,4014,year chin mal prostitut giv brojob,1,1.4,0.0,2.7
4014,4015,favourit sex posit jfk splatter scream tri get car,1,2.89,1.0,3.4
4015,4016,worst part necrophil get stiff,1,1.9,1.0,2.65
4016,4017,lov convers black wom,0,,,0.15
4017,4018,know brea nos smil ha mad smil,1,3.11,1.0,0.0
4018,4019,saw ex girlfriend brok two flat tir morn mad lat work nin tim drov past not laugh,1,2.65,1.0,0.6
4019,4020,op carton ic cream stor freez upsidedown prev ic cryst form top,0,,,0.0
4020,4021,two teen knock door run away chas street dark alley beat stol wallet,1,1.8,1.0,0.5
4021,4022,sometim sleep guest bedroom wif snor want embarrass tel peopl fart,1,2.37,1.0,0.8
4022,4023,holiday season giv cowork gift say get candl candl,1,2.33,1.0,0.0
4023,4024,jap od kil gun be lik kil lightn,0,,,0.0
4024,4025,hous hunt want hous toilet bathroom wif talk poop wif want divorc,1,2.42,1.0,0.4
4025,4026,weird food combo lik eat,0,,,0.0
4026,4027,cal priest also lawy fath law,1,3.05,0.0,0.3
4027,4028,would tak 76 workday read priv policy av internet us encount year,0,,,0.0
4028,4029,germ tour ar warsaw airport immigr off ask occup germ respond holiday,1,1.8,1.0,1.15
4029,4030,eng op honest commun ess good ment emot heal pract self car learn bet com,0,,,0.25
4030,4031,son go vir dad congrat alway know mem would bring clout famy son mem say someth stupid already pul phon publ cancel son liv wood,1,2.2,1.0,0.1
4031,4032,psycholog say attempt convint car someon clear ind real,0,,,0.0
4032,4033,asparag del fol work vitamin b12a find fish poultry meat dairy help prev brain cognit impair,0,,,0.0
4033,4034,texa chainsaw massacr movy florid chainsaw massacr headlin,1,1.38,0.0,0.3
4034,4035,mag feel christmas morn gift op famy room look lik episod hoard,1,2.39,0.0,0.25
4035,4036,robot end on night stand nut bolt,1,2.95,1.0,0.2
4036,4037,nod head ye want say mean justin bieb,0,,,0.0
4037,4038,today on friend knock door instead text lik ancest us,1,2.35,1.0,0.1
4038,4039,find girlfriend lot lik fish plenty fish sea hold rod catch on,1,2.74,0.0,0.85
4039,4040,2014 7yearold girl nam charlot benjamin send let lego concern lego boy peopl bar lego girl month lat lego annount new research institut collect feat fem sci sell week,0,,,0.0
4040,4041,girl alway want ask go wit somewh wait invit,0,,,0.15
4041,4042,tir lumberjack magazin set complet unr standard wif read crap start quest stout hearty start ord flapjack every tim go eat jes almost 2020,1,1.1,0.0,0.0
4042,4043,trust rel start org work school church org etc shar expery honesty meas vuln,0,,,0.0
4043,4044,say in acceiv loss form ins prob tru sometim way stay al,0,,,0.0
4044,4045,wait bad day ord apprecy good on,0,,,0.0
4045,4046,swarm 20000 bee follow car two day queen trap insid,0,,,0.0
4046,4047,could find thingy peel carrot potato ask kid would see app leave day ago,1,2.2,0.0,1.65
4047,4048,many afr be mov detroit hear job,1,1.63,1.0,3.75
4048,4049,peopl stay busy lik happy remain idl accord study publ psycholog sci,0,,,0.0
4049,4050,diff black man bik bik start sing put chain,1,2.05,0.0,4.0
4050,4051,girl resta ask singl happy reply ye take away extr chair front,1,3.35,1.0,0.15
4051,4052,kim jongun travel toilet prev excret fal wrong hand wast contain inform heal stat leave behind,0,,,0.15
4052,4053,best part toddl get enjoy precy ad mom someon lov anyth world scream fac hit throw temp tantr,1,2.53,0.0,0.05
4053,4054,wif dress meg ryan say fantasy bas movy get mail assum would dress tom hank dress comput shhhh talk fing,1,1.9,1.0,0.2
4054,4055,last prim school prison pipelin chp summit,0,,,0.4
4055,4056,noth promot exceiv pleas rememb sort whit revid hap indig black folk sint wel tim rul thumb tim inexpl feel urg discredit traum inflict,0,,,0.05
4056,4057,film star war forc awak osc isaac spec ask charact poe dameron nat planet yavin 4 yavin 4 scen origin trilog film guatemal isaac bear,0,,,0.0
4057,4058,vitamin b6 break protein fat carbohydr food eat protein person eat vitamin b6 nee,0,,,0.0
4058,4059,60 day cle hard show every day thank heroin help,1,2.6,0.0,1.3
4059,4060,cal superhero bad sens direct wand wom,1,1.95,0.0,0.25
4060,4061,deathb confess wish would list girlfriend oft espec cross road yel bus,1,2.4,1.0,0.05
4061,4062,addict mex food lik taco bout,1,2.4,0.0,0.05
4062,4063,wash hand cold wat effect wash hand hot wat,0,,,0.25
4063,4064,lip synt min see miss lem know post,0,,,0.0
4064,4065,doll every gend doll every gend would 2 doll,1,2.44,1.0,2.0
4065,4066,burn 2000 cal last tim leav browny ov nap,1,3.8,0.0,0.0
4066,4067,sci find meaningless tak context med sci claim find meaningless,1,2.88,0.0,0.25
4067,4068,kind guy liv rul whatev lik lik follow rul,1,2.22,1.0,0.0
4068,4069,protip get giv wif back rub tel touch dead bird outsid,1,2.21,1.0,0.75
4069,4070,interest girl dat cathol guy guess could cal popeless rom,1,2.2,0.0,0.35
4070,4071,girlfriend alway lik laugh competit laugh intens gre strength,1,2.53,0.0,0.0
4071,4072,girlfriend say act lik detect much want split good ide reply cov grind way,1,3.35,0.0,0.0
4072,4073,nonstop cry sint yesterday seem wrap head around deeply person feel kob belov athlet famy many firstg kid lov fuck spec someon par could lov,0,,,0.0
4073,4074,black wom 5 son nam tyron tyron tyron tyron tyron tel apart cal last nam,1,2.2,0.0,4.1
4074,4075,lik say veg instead eat disord,1,1.53,0.0,2.15
4075,4076,cal chameleon chang col anym reptil dysfunct,1,2.5,1.0,0.05
4076,4077,black peopl work jail,1,1.44,0.0,4.0
4077,4078,homophob peopl oft fal short cre bas in apprecy divers altern cult symptom enough fact,0,,,0.45
4078,4079,surpr someon tri fistbump shov entir hand mou,1,1.63,1.0,0.15
4079,4080,cal okay arizon look okay,1,1.33,1.0,0.0
4080,4081,decid cal fun process deadlin,1,2.6,1.0,0.75
4081,4082,build al build nee cre rel network proact profess srinagesh gavirnen cornel univers profess jnfnc 19,0,,,0.0
4082,4083,nat be lik april april show bring may flow mayflow bring fuck whit peopl,1,3.15,1.0,1.5
4083,4084,russ gay common lik bear,1,2.1,1.0,1.4
4084,4085,hahah wir gam throne acceiv food think,0,,,0.15
4085,4086,congr team us presid cup vict yesterday team intern put gre fight proud,0,,,0.0
4086,4087,help kid find cur neuroblastom 5yo lacey nee help rtdonate http bitlydmhddz,0,,,0.0
4087,4088,sant work on night week spend rest year crank podcast,1,1.5,1.0,0.0
4088,4089,as act turn good driv good driv watch as turn,1,2.0,1.0,2.7
4089,4090,someon mak peopl apprecy today look forward tomorrow,0,,,0.0
4090,4091,momm fat aid clos lan georg washington bridg,1,1.85,1.0,1.5
4091,4092,emjo end text girlfriend two girl hold hand heart kissy fac glass win nail pol red lip,1,2.21,0.0,0.05
4092,4093,mak big appl crumbl first nee two plan happy 911 peopl,1,1.75,0.0,4.2
4093,4094,wisdom know know,0,,,0.0
4094,4095,swe contain smal amount antibiot comb bacter find nat skin skin swe,0,,,0.0
4095,4096,mom us fee broth say com train alway us eat right away otherw would unty us track,1,2.72,1.0,0.0
4096,4097,last person convict blasphemy unit stat arkansa man charl lee smi 1928 put sign storefront window say evolv tru bibl lie god ghost spend three month jail,0,,,0.3
4097,4098,main diff put toddl bed work peopl ment institut peopl ment institut reason,1,2.84,0.0,1.0
4098,4099,afternoon attack group gay men know escap beat leave right,1,2.05,1.0,2.4
4099,4100,chin lik box chocol kil dog,1,1.63,1.0,3.2
4100,4101,start think hard wheth fruit fli cam hous fruit hide hous wait fruit,1,2.12,0.0,0.0
4101,4102,nurs sperm bank ask would lik masturb cup say wel pretty good think ready compet yet,1,2.68,1.0,0.35
4102,4103,cop approach see girl hold photo yeah see nak hi5 hah sery trunk,1,1.8,0.0,2.25
4103,4104,speak tru ev hurt,0,,,0.0
4104,4105,job interview pour wat cup overflow slight nerv ask interview say alway giv 110,1,3.4,0.0,0.0
4105,4106,car adv be stud want leav colleg stud al,1,1.95,0.0,0.25
4106,4107,peopl scar pursu dream oft find way disco,0,,,0.0
4107,4108,lif pass wast tim kodalin,0,,,0.0
4108,4109,hap jew bon walk wal brok nos,1,2.0,0.0,2.8
4109,4110,worst part grief control best try let feel com,0,,,0.0
4110,4111,learn lik heal hap tim,0,,,0.0
4111,4112,ter pul head wat giv us tru damnit gasp jam marsd movy ter wel ye,1,1.84,1.0,0.9
4112,4113,want right kid becom right par,0,,,0.2
4113,4114,steph hawk ash bury grav isaac newton charl darwin part westminst abbey know sci corn bur europ spac ag beam record hawk voic closest black hol,0,,,0.0
4114,4115,tak 5 minut respond text think pay at,1,1.91,0.0,0.5
4115,4116,intercom job okay get high work passeng pilot lol passeng oh thank god anyway look leave see dragon,1,2.47,0.0,0.3
4116,4117,go los peopl lif real mat much tim spend nev seem lik enough,0,,,0.0
4117,4118,fuck fury 2020 peopl stil stand lin vot,0,,,0.4
4118,4119,rememb check googl stock lik 5 year ago around 500 today 1488,0,,,0.0
4119,4120,scary know tim could last tim talk someon alway keep mind,0,,,0.0
4120,4121,broth tel nee someon speak pleas ign list ear sav suicid heart,0,,,0.0
4121,4122,let push past break point katy perry,0,,,0.0
4122,4123,guy stut die prison could fin send,1,2.35,0.0,1.45
4123,4124,hop thread provid clar thank memb commun continu support let us get fre,0,,,0.0
4124,4125,bar see hot chick check writ not napkin ask bartend giv read not stop star rud,1,2.25,1.0,0.35
4125,4126,real lov way ear rot mak day rofl,1,1.63,1.0,0.0
4126,4127,room tell cloth look gay tell respect cam closet,1,2.4,0.0,1.15
4127,4128,misplac dwayn johnson cut tool origam workshop believ lose rock pap sciss,1,2.95,1.0,0.0
4128,4129,cal ind man stand on leg bal singh,1,1.25,0.0,1.9
4129,4130,gay peopl smil much hard keep straight fac,1,3.05,1.0,1.65
4130,4131,paty vitamin soul,0,,,0.0
4131,4132,bad rainbow go prism,1,2.55,1.0,0.0
4132,4133,today meet veget broth bruc lee brocco lee,1,2.55,0.0,0.0
4133,4134,sad see reach wal go miss,0,,,0.05
4134,4135,win pair best tax,1,1.94,1.0,0.0
4135,4136,someon brok hous last night stol limbo stick low get,1,2.6,0.0,0.0
4136,4137,hey everyon sorry lack tweet tweet lot start next week lot triv gam sum,0,,,0.0
4137,4138,buddy tell hil jok ear albert einstein get handjob stroke geni rofl,1,2.7,1.0,0.85
4138,4139,hear egypt boatm refus believ craft sink den,1,2.11,0.0,0.35
4139,4140,woodworm walk bar ask bar tend,1,2.37,0.0,0.0
4140,4141,big fan peopl exact buy zoo 2011,0,,,0.0
4141,4142,hat argu wif lik com big argu giv sil tre get play video gam,1,2.85,1.0,0.3
4142,4143,bet would mak gre superhero also see famy car troubl park sid road sur someon els help,1,2.71,0.0,0.05
4143,4144,attack 1 3 5 7 9 od,1,2.55,1.0,0.0
4144,4145,1 rul learn engl know rul,1,2.79,1.0,0.25
4145,4146,get airpl hand board pass airlin employ wif pass nee on emot support wif employ look airlin employ dammit get us everyon airport slow clap get plan,1,2.0,1.0,0.35
4146,4147,wom walk bar ask bartend doubl entendr gav on rofl,1,1.3,1.0,0.25
4147,4148,blond say look bowl cheerio look donut see,1,2.1,0.0,1.4
4148,4149,friend tell wif daught look lik twin say wel sep bir,1,2.1,0.0,0.25
4149,4150,hors hors whisp abrupt stop laugh ent stabl fork hay back see cry,1,1.46,1.0,0.1
4150,4151,crocodil quick regrow miss tee fact crocodil go many 8000 tee lifetim,0,,,0.0
4151,4152,dream lik liv forev pray lik die today,0,,,0.0
4152,4153,religy group put perform audy christians put hel show jew knock sock muslim blow away,1,1.9,1.0,3.1
4153,4154,sheep say saw girlfriend baaaaa,1,1.9,1.0,0.0
4154,4155,wom ind giv bir 23 pound baby doct say littl sanjeev walk six month mum,1,2.0,1.0,0.55
4155,4156,stop us posit influ socy bul exploit innoc gay guy crimin act straight past polit milit off onair person bank corp lead see,0,,,0.35
4156,4157,want mak sur timelin poppin dop black transgnt folx follow,0,,,0.6
4157,4158,first 40 mil year wood tre ex biodegrad wood would decompos fung learn mak rot,0,,,0.0
4158,4159,stay every night watch sitcom rerun lik every night prom night,1,1.68,0.0,0.0
4159,4160,beauty ey atleast see wor,0,,,0.0
4160,4161,stop tel new boyfriend ex busy shit sick ex gon expir forget foc new find lov,0,,,0.25
4161,4162,get 100 drink rowdy canad pool say pleas get pool,1,2.42,1.0,0.35
4162,4163,mak chin clon uneth hahah kid mak math tut,1,1.68,1.0,1.6
4163,4164,noth embarrass ask person stal next phon charg,1,2.11,1.0,0.0
4164,4165,chocol assocy releas serotonin hormon mak feel relax calm happy,0,,,0.0
4165,4166,hom improv show nev ment start renov project rebuild hous also marry,1,2.32,0.0,0.2
4166,4167,old enough blee old enough decid healthc hand old whit men,0,,,1.5
4167,4168,effort sexy wif fig would pluck 60 chest hair 3 5,1,1.8,1.0,0.0
4168,4169,download as dat rap ap new phon ub common know,1,1.55,0.0,3.65
4169,4170,wif say mak many pun swe sur saunabout,1,2.4,0.0,0.0
4170,4171,say pee ireland spot leprechaun urin luck,1,2.35,0.0,0.45
4171,4172,could join kkk want bloodlin pur enough turn par ev rel,1,2.55,0.0,1.0
4172,4173,abl com pass chadwick bosem light know say,0,,,0.0
4173,4174,welcom 40s abl sneaky hind bon crack walk,1,3.25,0.0,0.25
4174,4175,keep cre juic flow way prev writ block aunty red tweet tea,0,,,0.0
4175,4176,overbear moth melon say son girlfriend cantaloup,1,2.55,1.0,0.0
4176,4177,punch whit guy gas stat last week get arrest assault punch black guy shop cent today get arrest imperson pol off,1,2.65,1.0,2.7
4177,4178,god mak hum god mak eat food on enjoy thing ev angel good ide god pun mak fat hahah angel problem hom,1,2.75,1.0,0.95
4178,4179,cal mex midget paragraph short essay,1,1.6,0.0,2.2
4179,4180,say go grocery shop hungry week keep get hungry,1,2.74,1.0,0.0
4180,4181,tak wif dat op door chivalr door bus op,1,2.21,1.0,0.15
4181,4182,lov on acceiv diagnos heal beg entir famy take long take year beb campbel moor,0,,,0.0
4182,4183,islam act nic peac tol relig wrong read right leave,1,1.6,0.0,1.95
4183,4184,englishm irishm scotsm decid bbq englishm bring meat irishm bring whiskey scotsm bring dud aberdeen,1,1.2,1.0,0.5
4184,4185,cal fruit veget crippl homo,1,0.89,0.0,3.75
4185,4186,without forg old scor nev settl old wind nev heal hop 1 day lucky enough forget,0,,,0.15
4186,4187,hot keep dunk head rel fath,1,1.37,0.0,0.5
4187,4188,hum burp spac grav sep gas ingest food burp spac may astronaut throw,0,,,0.0
4188,4189,suicid ten lead dea be prev someon know may consid suicid contact nat suicid prev lifelin 18002738255 ai 12,0,,,0.0
4189,4190,see mean believ nightm christmas,0,,,0.0
4190,4191,wom walk drugst ask pharmac sel siz extr larg condom reply ye would lik buy respond sir mind wait around someon,1,2.8,0.0,0.5
4191,4192,heart break littl hear nam bruno mar,0,,,0.0
4192,4193,get expery throat surgery let us sing barbershop quartet without mak 3 friend,1,2.21,1.0,0.05
4193,4194,would cal islam stat tri tak antarctic ic,1,3.1,1.0,0.9
4194,4195,point mayb acceiv dream becom nightm tel real bet,0,,,0.0
4195,4196,dat girl wheelchair brok keep push around,1,2.65,0.0,2.2
4196,4197,exw stil miss aim get bet,1,3.25,0.0,0.2
4197,4198,slap christian girl ass would turn cheek,1,2.1,0.0,2.05
4198,4199,stay thank dud,0,,,0.0
4199,4200,paddy irishm say meet on leg jockey gettin,1,2.0,0.0,0.5
4200,4201,us fmri sci discov dog recogn sound hum voic feel emot lov way hum,0,,,0.0
4201,4202,man right arm right leg fal wheelchair thank wom pass not approach off help alright leave,1,2.15,0.0,1.6
4202,4203,cal teach fart publ priv toot,1,2.0,0.0,0.1
4203,4204,tim sing happy birthday slow us tim hand wash,1,1.36,0.0,0.0
4204,4205,veg say sel meat disgust say sel fruit veget groc,1,2.95,0.0,0.55
4205,4206,rac as today tha,1,2.5,0.0,1.2
4206,4207,research convert mormon find giv 10 incom guess jew,1,2.2,1.0,2.35
4207,4208,oh also mak sur follow instagram,0,,,0.0
4208,4209,ask many peopl lgbtq stand far on giv straight answ,1,3.3,0.0,0.8
4209,4210,peopl eat spicy food tend liv long accord study harvard school publ heal,0,,,0.0
4210,4211,sci detect unexplain radio sign com spac word ev god podcast,1,2.81,0.0,0.4
4211,4212,fast eat weight lik gain,0,,,0.0
4212,4213,put on foot front get day,0,,,0.0
4213,4214,dat worst fear liv expect ev lay across piano sing hold,1,1.25,0.0,0.3
4214,4215,worst thing black jew sit back ov,1,1.6,0.0,4.0
4215,4216,let know mind mak feel good,0,,,0.0
4216,4217,many potato tak kil ir person non,1,2.79,1.0,1.7
4217,4218,amaz vis driv everyon arav mak world bet plac dr joaquin ruiz,0,,,0.0
4218,4219,nonbin prospect mov californ 1849 gold themtheir hil,1,2.65,1.0,0.45
4219,4220,sci larg brain allow us surv success 10000 year old tre k,1,2.0,1.0,0.0
4220,4221,nintendo 64 old wom common blow dust stick hah,1,1.8,0.0,2.35
4221,4222,drug problem dea keep tak away,1,2.83,1.0,0.15
4222,4223,annoy littl cousin keep brag sleep rac car bed wel jok littl shit sleep real car,1,2.61,1.0,0.3
4223,4224,kar kid 1984 pg old as man trick bul teen household chor 126 minut,1,3.0,0.0,0.25
4224,4225,think landlady opposit mermaid,1,2.35,1.0,0.0
4225,4226,dog curl nap nev poop carpet lov cat wif dog talk sleep shhh let sleep dog lie,1,3.21,1.0,0.0
4226,4227,hootenanny angry throw glass bourbon fir tell would shindig,1,1.83,1.0,0.0
4227,4228,someon ask mean say fin mean say cri sleep last night spok anoth person two consecut day fin say el oliph complet fin book connect us,0,,,0.15
4228,4229,long hard black guy first grad,1,1.89,0.0,4.3
4229,4230,boss cam lunch hel try find morn shrug say good employ hard find,1,2.65,0.0,0.1
4230,4231,peopl say god nev giv handl nev meet exgirlfriend,1,2.55,0.0,0.35
