,id,text,is_humor,humor_rating,humor_controversy,offense_rating
5859,5860,10 year giv adv coach hundr cli ident 7 diff distinct fem person prevy episod go delv on think want man connect on,0,,,1.0
5860,5861,somol pir us weapon arrrrpg,1,2.32,1.0,0.1
5861,5862,go hug tsa ag say arm straight,1,2.25,1.0,0.0
5862,5863,many transgend peopl tak chang lightbulb on sit dark room year first mak sur lightbulb definit,1,2.16,1.0,3.1
5863,5864,yo mam fat goe new york peopl say on big appl,1,1.9,0.0,1.55
5864,5865,procrastin com latin word mean put tomorrow perendin mean put day tomorrow extend period,0,,,0.0
5865,5866,saw fat dud lick pizz greas shirt last tim eat front mir,1,2.37,0.0,0.65
5866,5867,know piranh devo hum child bon 30 second anyway lose job aquar today,1,2.9,0.0,1.25
5867,5868,mul highest killcount disney charact includ villain also first disney princess show kil peopl onscreen,0,,,0.2
5868,5869,lie go halfway around world tru ev sho,0,,,0.0
5869,5870,9 guy nev comp anoth girl boyfriend tip,0,,,0.25
5870,5871,day septemb 4 2002 kel clarkson 20yearold cocktail waitress texa first season be idol,0,,,0.0
5871,5872,on jes greatest mirac carp bring every tim meet,1,2.06,1.0,0.7
5872,5873,tru lov find way introduc famy friend mayb boyfriend least best friend tru lov hide gay,0,,,0.15
5873,5874,ev play quiet ten lik regul ten without racket,1,2.8,1.0,0.0
5874,5875,want mov desert island tot cut socy also good wif,1,2.4,0.0,0.0
5875,5876,psych dwarf confirm escap prison pol warn smal med larg,1,2.7,0.0,0.85
5876,5877,stop look reason unhappy foc thing many reason happy,0,,,0.0
5877,5878,nobody deserv tre lik opt,0,,,0.0
5878,5879,class interview craig mil cre popul seduc program seduc touch tell us friend magik unattract ind guy acc abl meet attract hot girl us pow subconscy sign cre touch,0,,,1.0
5879,5880,cal go discov cur blind mak bil doll someday see,1,2.11,0.0,0.5
5880,5881,lif ful stress rel must ful peac calm neg vib dram,0,,,0.0
5881,5882,import hond direct jap forc pay larg tariff ok though civ duty,1,2.67,1.0,0.0
5882,5883,1970s georg luca own alask malamut nam indian wrot indian would alway sit next inspir giv han solo sidekick lik big furry dog inspir chewbacc indian jon nam nat dog day,0,,,0.0
5883,5884,quick nap increas alert also improv decisionmak cre sens perceiv,0,,,0.0
5884,5885,pick not squint mov away fac word old becom clear gasp,1,2.56,0.0,0.0
5885,5886,let someon mean abandon wal spend lifetim build,0,,,0.0
5886,5887,dav adv cav limerick man nam dav find dead whor cav ug shit miss on tit think money sav,1,2.05,1.0,3.1
5887,5888,friend mum los cos deal son gay know clos straight friend go broadcast church reject propos guy hypocrisy disloyal backbite eat gay commun al sad,0,,,0.7
5888,5889,hat keep nam mou gag,1,1.1,0.0,0.15
5889,5890,tran dayof remembr hon black tran sibl lose remain commit car stil fee folx alway pri fund run dang low nee help continu op thread,0,,,0.05
5890,5891,talk polit peopl young pres idea almost import cont idea talk polit peopl old every singl billionair inh piec shit jail,1,2.0,1.0,1.05
5891,5892,decapit flatworm regrow head mem return wel,0,,,0.0
5892,5893,tomorrow nev guarantee want know lov thank alway support,0,,,0.0
5893,5894,tel transgend real wom qual sandwich,1,2.1,1.0,2.85
5894,5895,init approach on biggest issu lot guy fac com meet wom keep convers go keep eng today learn 3 simpl yet intim quest ask girl get attract,0,,,0.1
5895,5896,saw post say see cat ring numb tell lik help,1,2.84,1.0,0.15
5896,5897,grav disappoint someon simply keep mou shut someth noth simply mind busy,0,,,0.05
5897,5898,ev sint start wear camo tim girlfriend say see anym,1,2.3,1.0,0.0
5898,5899,sun 100 mil bil pound burn hydrog hel carbon neon iron plant yum yum wat,1,2.59,0.0,0.0
5899,5900,today nat bagel day favorit typ bagel  ,0,,,0.0
5900,5901,farm desert supply food sec network israel tak lot prid short marketw proud serv peopl noa zer cent arav reg council pow jnf lov grow israel,0,,,0.0
5901,5902,swe think wireless headphon get defect wif earmuff,1,2.3,0.0,0.45
5902,5903,act respons say liar liar pant fir car car buy anoth pair,1,2.17,1.0,0.0
5903,5904,meet girlfriend dad last weekend tell anyth daught il front lawn say suppos buy din front lawn,1,2.55,0.0,0.1
5904,5905,rock pee dwayn johnson,1,2.25,0.0,0.45
5905,5906,wast word peopl deserv sil,0,,,0.0
5906,5907,wif rec brok compuls gambl think win back,1,2.65,0.0,0.2
5907,5908,flam inflam mean thing,0,,,0.05
5908,5909,new girlfriend real tak brea away infl,1,2.55,1.0,0.65
5909,5910,get mix alcohol light tequil mockingbird,1,2.63,1.0,0.2
5910,5911,sometim heat argu say thing mean sorry sil goos dad talk,1,1.86,1.0,0.0
5911,5912,cathol worst driv alway pul last second us avoid child,1,2.26,1.0,2.45
5912,5913,trip random think bout twin honey bn crazy nest rip carpet room instal new hardwood flo w stepdad buy new furnit two everyth nee big suv ev new hous sheesh,0,,,0.15
5913,5914,wif walk hug spid web black belt kar,1,2.6,1.0,0.0
5914,5915,depress fatigu oft symptom dehydr wat depress,0,,,0.2
5915,5916,alcohol wak jail ask first pol off see drink reply off gre say man start,1,3.3,0.0,0.05
5916,5917,involv three car pil rec man escap dead leg sur find keep,1,3.12,1.0,0.8
5917,5918,hear voic would chang mind dear john,0,,,0.05
5918,5919,wif proud son hang wrong crowd drink drug best 2 year old could ask,1,2.6,0.0,0.2
5919,5920,exgirlfriend lik incompet tail suit,1,2.21,0.0,0.15
5920,5921,gay person eat breakfast anyth want,1,1.22,1.0,1.25
5921,5922,mag girlfriend say mag see anym,1,2.3,0.0,0.0
5922,5923,hop warm halloween wear coat go ruin nud costum,1,1.9,0.0,0.35
5923,5924,fem world record orgasm hour 134 mal world record 16,0,,,0.3
5924,5925,smok kil bacon kil smok bacon cur,1,2.8,1.0,0.0
5925,5926,q cal 1000 heavy arm lesb milit etheridg,1,1.1,0.0,2.15
5926,5927,lose mood ring today know feel,1,2.7,0.0,0.0
5927,5928,nee believ toy story 2,0,,,0.0
5928,5929,diff gspot golf bal guy act spend tim search golf bal,1,2.75,1.0,0.9
5929,5930,reject someth good mean point toward someth bet,0,,,0.0
5930,5931,com americ vh1 right yet anoth gift holiday season mc dowel,0,,,0.0
5931,5932,unfortun lose kor friend day yung seo mat,1,2.35,0.0,1.65
5932,5933,diff mex elev on rais child,1,1.55,0.0,4.2
5933,5934,sunday march 7 1965 help lead march vot right edmund pett bridg selm alabam march brut attack heavy arm loc stat pol,0,,,0.0
5934,5935,nee retroact chang stat peopl perpetu hide pattern rac hero villain villain deserv statu,0,,,0.5
5935,5936,forget tel past don,0,,,0.0
5936,5937,kid sleep away camp stil rememb excit get let mom dad attorney,1,1.94,1.0,0.55
5937,5938,geny could end world hang war sur wish elsewh mcdonalds ceo sit bed nee sel mcsoup,1,1.05,0.0,0.15
5938,5939,eat explain chin class mat dog,1,1.6,0.0,3.7
5939,5940,run deer teach anyth someth horny plow hood car,1,1.65,0.0,0.8
5940,5941,proud gratitud us embrac becom journey learn grow,0,,,0.0
5941,5942,hardest part break japan girl drop bomb twic get point,1,2.37,1.0,3.2
5942,5943,end alway right thing ev hard,0,,,0.0
5943,5944,see new docu redneck see trail,1,3.0,1.0,1.8
5944,5945,sint 2007 mcdonald delivery truck uk fuel us cook oil resta,0,,,0.0
5945,5946,blueberry reduc bel fat fight ag diseas preserv vis extrem high antioxid capac heal fruit,0,,,0.0
5946,5947,ev think somebody els mak lov wif ask shock say would ask vr glass,1,2.5,1.0,0.2
5947,5948,cuz know cal hous hous last episod red talk expery fost mom answ second let day gain famy fosteradopt let us know lov hear que famy,0,,,0.6
5948,5949,keep blond busy year tel count stair esc,1,2.15,1.0,2.6
5949,5950,friend mexico get bite mosquito could fig be friend receiv bite wel tell bug hungry mex tonight,1,2.25,1.0,1.65
5950,5951,alway know push button giv everyth noth tayl swift,0,,,0.0
5951,5952,murd rip op show curtain wear sho,1,1.84,1.0,0.0
5952,5953,6 perfect formul avoid burnout want enco fut phys medicin stil amaz cal burnout guar med twit doc,0,,,0.0
5953,5954,pun peopl front mistak mad peopl behind,0,,,0.0
5954,5955,throw as man flight stair wong many level,1,2.35,1.0,3.2
5955,5956,would iron black pop elect would surround men whit rob pointy hat lik old day,1,2.47,0.0,3.1
5956,5957,bump stick say honk think sexy sit green light feel good,1,3.25,1.0,0.0
5957,5958,on thing fal anoth grow mayb someth new wond bamb,0,,,0.0
5958,5959,jnf sunshin tour quit tim ter experienceit alway joy tour hal lind emmy award win act pow jnf jnf demand,0,,,0.0
5959,5960,every look around drink might gon tomorrow,0,,,0.0
5960,5961,neighb cal dog fat day take two hour convint dog thick fur,1,2.95,1.0,0.4
5961,5962,us money heal hiv long dea send get tre fin,0,,,0.6
5962,5963,many femin tak screw lightbulb filthy man,1,1.75,0.0,1.1
5963,5964,but gre sourc vitamin e k contain conjug linol acid wch ant ag musc build immun boost,0,,,0.0
5964,5965,gav wif phon numb friend text ask allow go play,1,2.5,0.0,0.35
5965,5966,cup cantaloup contain 5158 iu vitamin 67 mg vitamin c recommend dai valu,0,,,0.0
5966,5967,accord study garl powd benefit whol garl powd vert whol garl garl,0,,,0.0
5967,5968,liv right enough,0,,,0.0
5968,5969,wif tri cut pen lucky miss cop charg misdewy,1,2.65,1.0,1.0
5969,5970,pain rid hop goe away hop wind heal solv easy answ,0,,,0.0
5970,5971,tim precy thing nev wast wil wonk chocol fact,0,,,0.0
5971,5972,ten tornado texa divorc common someon go los trail,1,2.15,0.0,0.75
5972,5973,selfdeprec jok gre good,1,2.44,1.0,0.4
5973,5974,lot hot old wom look young guy hook prevy episod talk meet typ wom know sur avail look 1 person qual must connect,0,,,0.55
5974,5975,tak shirt pant get bed sock underwear mattress salesm dud,1,2.4,1.0,0.25
5975,5976,eat breakfast afric ebol cer,1,1.4,0.0,2.85
5976,5977,stonstrong obvy auto correct suck,0,,,0.0
5977,5978,circ fir tent,1,2.74,0.0,0.0
5978,5979,lif giv lemon us nat acid temp blind oppon,1,2.63,0.0,0.15
5979,5980,par say get tattoo would get plac mat get buford wyom,1,2.89,0.0,0.45
5980,5981,diff slut bitch slut fuck everyon bitch fuck everyon,1,2.25,0.0,2.85
5981,5982,blind guy say deaf guy hear say see point,1,2.55,0.0,0.8
5982,5983,think therapy dog mak everyon feel bet exceiv peopl wast year liv go school becom therap replac chocol lab educ,1,2.37,0.0,0.25
5983,5984,netflix trend sect popul sect right next ton overlap seem real judg mean lik quest convict,1,1.94,1.0,0.0
5984,5985,happy birthday mar pray bless today lov,0,,,0.05
5985,5986,47th wed ruin hit 50 retir con friend https tcorroipvfp1m,1,1.95,0.0,0.15
5986,5987,grandmoth spee dial cal instagram,1,2.55,1.0,0.0
5987,5988,invis man invis wom get marry kid anyth look,1,3.25,0.0,0.0
5988,5989,understand peopl want kid mean want feel phys emot drain tim reward,1,2.63,0.0,0.15
5989,5990,spend 3 hour try solv rubik cub son tell appl may nee nap,1,2.15,0.0,0.0
5990,5991,alway go anoth mountain alway go want mak mov miley cyr,0,,,0.0
5991,5992,miss good old day would ign cel phon cal want wast daytim minut unlik today hat,1,2.43,0.0,0.2
5992,5993,exgirlfriend go blind brok could see anym,1,2.1,0.0,0.45
5993,5994,bartend say serv tim travel tim travel walk bar,1,2.55,1.0,0.0
5994,5995,on comm mak diff tel someon diet dr pep,1,1.32,0.0,0.2
5995,5996,hot tak bad thanksg guest dish mad nee precy fridgeov spac go shit map,1,1.6,0.0,0.35
5996,5997,girlfriend us take restrain ord stat ment unst immedy wrot stern word let protest innoc unfortun could find pen wrot wal shit,1,2.47,1.0,1.55
5997,5998,boil funny bon becom laugh stock,1,2.79,0.0,0.05
5998,5999,inspir tweet nev comp peopl comp pigeon pretty much moron mak feel bet,1,2.58,1.0,0.1
5999,6000,red smel rudolph nos,1,2.5,1.0,0.3
6000,6001,let us say next lip synt go back bas,0,,,0.0
6001,6002,want see every piec art louvr on visit spend 30 second look on would tak mon see assum 247 take break nev sleep,0,,,0.0
6002,6003,see advert tv gillet say eas stress press shav men suggest man feel press stress fuck shav mayb consid wax vagin instead,1,2.95,1.0,1.65
6003,6004,go bathroom com e vowel mov,1,2.42,0.0,0.2
6004,6005,yesterday spot albino dalm least could dog,1,2.78,1.0,0.0
6005,6006,rec start work homosex hard tim deal sticky mess insist styl hair us gel appear profess,1,1.41,0.0,3.05
6006,6007,muslim wom insist dress lik ninja also act lik disappear,1,1.56,0.0,4.05
6007,6008,success mat famy leave behind,0,,,0.1
6008,6009,reason say would happy alon think lov someon fel apart might mak,0,,,0.0
6009,6010,hard try mov forward tempt nev look back past alway com back bite us ass,0,,,0.05
6010,6011,know many 3rd party sect cathol church protect non cathol allow protect sect,1,2.25,0.0,1.15
6011,6012,search nycbas black transgnt perform upcom ev sing rap dant act mus poet art kind drop ya email link work,0,,,0.55
6012,6013,go libr ask book tiny dick libr say think yet say ye on,1,2.74,1.0,0.85
6013,6014,someon lik nam thank get birthday,1,2.0,0.0,0.0
6014,6015,many femin tak chang lightbulb sil femin chang anyth,1,1.7,0.0,3.8
6015,6016,rob put money bag mcdonalds cashy ok kil rob put sprite wat cup mcdonalds cashy fuck would rath die,1,2.39,0.0,0.85
6016,6017,marry mean less,0,,,0.05
6017,6018,ultrasound nurs baby vis reliev oh jes thank wif whisp nurs think bee,1,1.79,1.0,0.15
6018,6019,burg nev say die resta best bond movy ev,1,1.47,0.0,0.0
6019,6020,90 wildl find madagasc find nowh els ear,0,,,0.0
6020,6021,lesb neighb gav rolex birthday guess misunderstand say want watch,1,2.85,1.0,1.5
6021,6022,rel aquam swim shirt,1,1.8,1.0,0.0
6022,6023,us tim reset fin examin handl money start set budget bas incom spend less earn sav money invest sav dr joseph shepherd ste reset covid 19,0,,,0.25
6023,6024,wom wak vagin tuck find three bunch flow besid bed on surgeon say go wel on husband get wel soon lov on tommy burn unit say thank new ear,1,2.68,1.0,1.0
6024,6025,fath conjoin twin broth unc fath sid,1,2.94,1.0,0.05
6025,6026,cal blond whit guy blu ey expery soldy work sick anim vet ary,1,1.89,0.0,1.3
6026,6027,ug person alway ruin beauty fac,0,,,0.05
6027,6028,lov hoody man skinny fat nobody know,1,2.0,0.0,0.0
6028,6029,wow 1700 put us halfway goal 3000 giv day 10 way 10k overal goal thank outpo lov support get 3k today,0,,,0.15
6029,6030,wif row fin light crawl hand kne say get bed fight lik man,1,2.21,1.0,0.4
6030,6031,say term chin vir rac say term kung flu rac cal wu ping cough,1,2.1,1.0,2.4
6031,6032,whistl blow test congress hop wear ref uniform,1,2.11,0.0,0.2
6032,6033,cannib choos last meal fiv guy,1,2.1,1.0,0.0
6033,6034,pretty hypocrit word repetit three e two two,1,2.06,1.0,0.0
6034,6035,lov el pompeo pleas reply first nam ad project,0,,,0.0
6035,6036,say childbir pain thing someon expery mayb young rememb think hurt much,1,2.76,0.0,0.0
6036,6037,read import giv room ex beyond real giv hum merg mind connect dream empathy understand escap read lov act mat haig not nerv planet book connect us,0,,,0.0
6037,6038,hir on high produc tox work dam company bottom lin hir sev less produc coop employ accord harvard research,0,,,0.2
6038,6039,jew get circumc jew wom touch anyth least 10,1,3.2,1.0,2.85
6039,6040,wif get marry cel phon tow ceremony gre receiv perfect,1,3.16,1.0,0.2
6040,6041,day boy us bul school stil tak lunch money plu sid mak gre subway sandwich,1,2.6,1.0,0.35
6041,6042,whit peopl shoot streets lik black peopl shoot school class,1,1.9,0.0,3.9
6042,6043,adv would giv someon com first tim,0,,,0.0
6043,6044,proteolys mean break protein help body digest protein efficy pineappl rich proteolys,0,,,0.0
6044,6045,hear on wealthy lesb prostitut mak money hand fist,1,1.75,1.0,1.85
6045,6046,saw lady vog alon felt bad start dant anyon know sign langu sorry,1,2.0,1.0,1.2
6046,6047,playst 2 gre popul sony continu mak mon playst 4 annount,0,,,0.0
6047,6048,din ask dat favourit fairyt littl girl reply sleep beauty definit say wel happy coincid ey light say reply slip rohypnol win,1,1.7,0.0,3.35
6048,6049,naruto on best story anim fkin good,0,,,0.15
6049,6050,marry counsel wif gambl addict ruin marry therap tru 6 1 od pul wallet anyon want mak interest get,1,2.16,1.0,0.1
6050,6051,butterf get tramp stamp trashy whit girl,1,2.39,1.0,1.45
6051,6052,list snot nos punk bet respect fak badg,1,1.5,1.0,0.55
6052,6053,say go kick ass nurs hap,1,2.21,1.0,0.0
6053,6054,thrill annount med stud scholarship award cortlyn brown nan asab,0,,,0.0
6054,6055,shar amaz photo israel chant win 5star hotel stay jerusalem thank spons isramisrael ent submit photo israel instagram fb follow jnf instagram fb capt tag jnf ad israel photo pow jnf,0,,,0.25
6055,6056,1 eg yolk 300 microgram cholin import reg brain nerv cardiovascul system heal,0,,,0.0
6056,6057,mex cal spic spic span,1,1.65,0.0,3.2
6057,6058,shark guil pleas mou ful seam rofl,1,2.45,1.0,0.65
6058,6059,nev understand school shoot jok guess aim young audy,1,2.28,1.0,3.0
6059,6060,try introduc wif scooby doo sex fantasy think work say split go par hous look clu gard,1,2.25,1.0,0.35
6060,6061,redneck murd hard solv dent record dna,1,3.11,0.0,1.85
6061,6062,dat hard guy lik hot but stuff yet girl lik 3 day ring,1,1.85,0.0,1.05
6062,6063,sur whit peopl say n word least say phrase lik thank warn off hey dad,1,2.06,1.0,2.95
6063,6064,adult mean eat want want also mean real cap mak healthy cho get person train mak meal plan say on tel eat screw guy adult,1,2.0,1.0,0.1
6064,6065,many peopl say get turn around say watch nev say nev,0,,,0.0
6065,6066,chang lik fear stop com,0,,,0.0
6066,6067,arab return libr book day duba,1,2.45,0.0,0.45
6067,6068,break bad team off 75 mil produc three episod fin season estim earn fiv year team refus say fin episod accommod addit instal,0,,,0.0
6068,6069,liv world worst cas scenario cut hop best many tim best hap,0,,,0.0
6069,6070,nat be successful strippers dant mak rain,1,1.65,1.0,2.65
6070,6071,think girlfriend lov einstein the driv us away hey good guy understand want tim spac,1,2.41,1.0,0.0
6071,6072,must wil let go lif plan lif wait us,0,,,0.0
6072,6073,studio exec ok get winny pooh eey nam on writ tig studio exec half list woah fuck say,1,1.63,1.0,1.15
6073,6074,stick gift sen mitch mcconnell go wrong body glit,1,0.84,0.0,0.8
6074,6075,cours go push away hat vuln go nee stick,0,,,0.0
6075,6076,buddy set blind dat say head expect baby felt lik idiot sit bar wear diap,1,2.75,1.0,0.05
6076,6077,award best neckwear goe wel would look tie,1,2.25,0.0,0.0
6077,6078,q mean ign apathy know car,1,3.05,1.0,0.0
6078,6079,start gir haj lov,0,,,0.0
6079,6080,fart lik egypt pharoah toot common,1,1.95,1.0,0.35
6080,6081,spous perfect ord exact nee,0,,,0.0
6081,6082,cre johnny bravo cre powerpuff girl cre dext lab room colleg,0,,,0.0
6082,6083,diff gay man straight man mustach smel,1,2.3,1.0,2.45
6083,6084,wif tel piec meat process rub body but,1,2.4,0.0,0.4
6084,6085,constitut mexico first docu hist say every person right educ,0,,,0.0
6085,6086,guy say damn law sex good girl say noth drug leave unconscy,1,1.29,0.0,4.15
6086,6087,kid scary movy outsid haunt hous ok saw go kid definit die 12 minut c h c k e n,1,2.26,0.0,0.0
6087,6088,know tim know right know everyth could hard shak feel could don,0,,,0.0
6088,6089,cal cheap hook snatch dea valley,1,1.63,1.0,1.9
6089,6090,jew lesb say girlfriend tak virgin lhym,1,1.95,1.0,2.7
6090,6091,20 nev believ say fin norm fal apart boyfriend tip,0,,,0.0
6091,6092,get catch fre sampl get catch stol property pleas com sir real doubl standard,1,2.33,0.0,0.15
6092,6093,wil nelson smok wee roof whit hous presid jimmy cart son,0,,,0.05
6093,6094,girlfriend lov toenail start think nailphil,1,1.68,0.0,0.0
6094,6095,would help could see els com would know best mom liv,0,,,0.0
6095,6096,fear dea fear condit die,0,,,0.15
6096,6097,hear guy whos whol leave sid get shav train hear right rofl,1,1.58,0.0,0.65
6097,6098,near 70 be less 1000 sav account accord 2019 survey 45 sav,0,,,0.0
6098,6099,wif catch look pinterest tri cov porn sit fast,1,2.68,1.0,0.2
6099,6100,cal wom beauty hundr tim cal wom beauty hundr tim rememb cal fat on tim nev forget eleph nev forget,1,2.44,0.0,3.3
6100,6101,panda show littl interest company friend spend tim alon pref find spot bamboo eat gon find new spot,0,,,0.0
6101,6102,lik hug spn famy,0,,,0.0
6102,6103,moth hand 20 tak broth see movy birthday keep 200 fath set surpr party day real broth favorit twin,1,3.26,1.0,0.05
6103,6104,gay marry enco peopl gay way hang around tal peopl mak tal,1,2.5,1.0,0.4
6104,6105,wif ask could peac quiet tri cook din take battery smok alarm,1,2.6,1.0,0.55
6105,6106,poss gay stil read bibl lov lord,0,,,0.0
6106,6107,bruc wayn jew would bar mitzvah bat mitzvah,1,2.15,1.0,0.8
6107,6108,frust birthday card stor suck real much ask abl purchas piec cardboard exact word quant un spec rel wif 499 get togeth hallmark,1,3.35,0.0,0.0
6108,6109,whenev see hot girl streets lik holy crap outsid,1,1.44,0.0,0.15
6109,6110,day sex marry wom husband cam hom ear tell would us back door say would quick reflect leave every day get off lik,1,2.22,0.0,1.15
6110,6111,interview not us lot contract writ lik tar on,1,1.95,0.0,0.0
6111,6112,effort 2 squash pos daught help start instagram profil chk hint nam,1,1.17,1.0,0.0
6112,6113,doggystyl revers cowboy midnight sky,1,1.6,1.0,0.75
6113,6114,jew lead egypt wom mumbl 40 year could stop ask direct mos say mann,1,2.2,0.0,0.65
6114,6115,want start muslim tind cal asalamalikeem asalamahateem,1,1.75,0.0,2.65
6115,6116,would cal soc med market geni masterbait rofl,1,1.56,0.0,0.35
6116,6117,hardest part vap tel par gay,1,2.16,1.0,1.95
6117,6118,wif throw away favourit herb thym wast,1,2.65,1.0,0.25
6118,6119,quick q notveryfam los cameo rud twit pay shoot apolog video,0,,,0.0
6119,6120,siz includ off siz 0 24 0x 4x styl petit plu collect cre everybody genx kohl,0,,,0.15
6120,6121,dav drown fun get wrea shap lifesav would want,1,3.0,0.0,0.9
6121,6122,meet girl club last night drink ask would lik go back plac sex want disappoint say,1,2.68,1.0,0.35
6122,6123,brok girlfriend lik wom lik lik coff without peopl dick,1,2.2,1.0,1.2
6123,6124,point let go mov way grow,0,,,0.0
6124,6125,ooooh kniv fre amazon prim want watch diss foo,0,,,0.0
6125,6126,engl ship start hms unit stat uss it ship amb stand ats boat,1,1.8,0.0,0.4
6126,6127,okr sery glad ask okr ev spec cur heal wel affin spac black tran peopl already hold beauty okr transfemimin folx broth okr transmasculin folx mon,0,,,0.45
6127,6128,wis man mak opportun find,0,,,0.0
6128,6129,cut doct walk must poison maf doct say at glowstick,1,1.45,1.0,0.0
6129,6130,pray many good spnfamily memb affect today ev manchest england,0,,,0.05
6130,6131,fairy tal triv wolf 3 littl pig wolf red rid hood room uc sant cruz,1,1.42,1.0,0.0
6131,6132,tell wif want crem mad appoint tuesday,1,2.65,1.0,0.2
6132,6133,girl walk bar ask bartend doubl entendr giv,1,1.11,0.0,0.4
6133,6134,want watch chernobyl minisery thank alex deeply engross cher bul lif,1,1.84,1.0,0.05
6134,6135,dehydr reach 5 increas heart rat extrem fatigu nause common symptom,0,,,0.0
6135,6136,hear dri grap lottery get supermodel girlfriend brand new car guess everyth hap raisin,1,1.84,0.0,0.0
6136,6137,get job seny direct old macdonald farm cieio,1,3.0,0.0,0.0
6137,6138,boom hop enjoy go kil pizz company supernatur spn famy,1,0.6,0.0,0.3
6138,6139,rememb sometim import hist hist mak today,0,,,0.0
6139,6140,rec trip wherev could believ gre thing,0,,,0.1
6140,6141,afraid chang mind acceiv thing diff nev bet wors,0,,,0.0
6141,6142,go cook wash housec prov lov man thing noth heart servitud precondit lov,0,,,0.0
6142,6143,doct nev mak jok unvaccin baby let giv shoot,1,2.42,0.0,0.0
6143,6144,kil kind mac charm,1,2.12,0.0,0.0
6144,6145,want someon play sup mario smash bro nintendo 64,0,,,0.0
6145,6146,reason someon smil reason someon feel lov kind word chang world,0,,,0.0
6146,6147,try find lowest rank army everyon keep say priv,1,3.3,0.0,0.15
6147,6148,addict money bank real suff withdraw,1,2.5,0.0,0.0
6148,6149,already begin convers black fai lead vary spirit tradit mak fai bas spac affirm black tran peopl new year launch fai okr sery,0,,,0.5
6149,6150,cal dracul retard cousin countdown,1,2.1,0.0,2.5
6150,6151,say milk good tee know els good tee mind fuck busy,1,2.21,1.0,1.45
6151,6152,friend real friend mean mat long tak fin decid look back stil,0,,,0.0
6152,6153,baby mam go nam kid pun intend,1,2.25,1.0,0.4
6153,6154,wif mayb tim talk ok son cop bust drug don drug talk,1,2.3,0.0,0.15
6154,6155,go weekend go buy glass see,1,3.0,0.0,0.0
6155,6156,wif difficult say sel seashel seash,1,1.74,0.0,0.2
6156,6157,wif say would leav stop eat past feel cannellon,1,2.05,1.0,0.0
6157,6158,fat monst put candl tummy celebr girthday,1,1.9,1.0,0.35
6158,6159,two wing on arrow chin telephon wing wing arrow,1,2.37,1.0,3.25
6159,6160,feel comfort skin unresolv demon handl lif challeng show problem rel wom aric angelo go show find lov first learn lov valu,0,,,0.0
6160,6161,lov pussy cunt around stand,1,1.95,0.0,3.8
6161,6162,sex act ask 93 year old paty ye smil fuck disgust say,1,2.33,1.0,1.65
6162,6163,delaw mayb new jersey know alask,1,2.12,1.0,0.0
6163,6164,sometim men nee spend tim alon without fem fig around them night friend would perfect gift,0,,,0.25
6164,6165,baby boom let dooby stronger stuff us smok ag twelv minut lat baby boom cal 911 hello ye would lik report crim somebody stol hand,1,3.0,1.0,0.4
6165,6166,jok dark hop get shoot pol,1,2.05,0.0,3.7
6166,6167,op por us moist mad w vitamin c vitamin c 1 solv problem enlarg por por skin,0,,,0.0
6167,6168,think girlfriend blind fet last night say stop see,1,2.85,1.0,0.6
6168,6169,peopl giv act not lik us leg much leg ign class cas jealousy,0,,,0.05
6169,6170,watch on old cholo adv video ev laugh laugh bunch,1,0.8,0.0,0.15
6170,6171,memb spn fam iy celebr happy new year rosh hashanah shan tov,0,,,0.0
6171,6172,xfil episod hom disturb air fox ban ev show network ev reair cabl channel fx,0,,,0.0
6172,6173,know best alway tak ppls wack ass adv,0,,,0.2
