,id,text,is_humor,humor_rating,humor_controversy,offense_rating
1958,1959,lov longsuff kind envy parad puff behav rud seek provok think evil rejo in rejo tru end thing lov,0,,,0.25
1959,1960,start read norweg air end flight ireland headlin becom whit stop read glar,1,1.47,0.0,0.7
1960,1961,bad ventil bedroom night result increas carbon dioxid assocy poor sleep headach declin cognit perform next day,0,,,0.0
1961,1962,wif would ev want op marry mess every girl phon ask would sex um respond nah,1,2.05,0.0,1.35
1962,1963,cannib eat clown tast funny,1,2.6,0.0,0.0
1963,1964,ind hat snow whit land,1,2.15,0.0,2.35
1964,1965,tea contain calm amino acid cal theanin help reduc jit keep mind relax focus calm tea,0,,,0.0
1965,1966,wrot nam peopl hat room us rol joint high list peopl nev want see,1,2.7,0.0,0.05
1966,1967,diff jewel jail on sel watch watch cel,1,2.15,0.0,0.1
1967,1968,tongu cle far effect way comb bad brea us tongu scraper cle tongu bad brea,0,,,0.0
1968,1969,ev get right mat hard try tri tel lie,0,,,0.0
1969,1970,paddy wif ready giv bir rush hospitalon ar nurs ask dil paddy rely oh jays fuck moon,1,2.25,1.0,0.15
1970,1971,many yo stat offend receiv harsh penal hit dog hit wom out eith way slap bitch,1,1.78,0.0,3.2
1971,1972,judg send dea tri off high fiv leave hang,1,2.6,0.0,0.35
1972,1973,long tak black wom poop nin month,1,1.61,0.0,4.7
1973,1974,lie poison heart,0,,,0.0
1974,1975,walk street new york black man cam ask yank win say yeah dud fre,1,2.39,1.0,2.5
1975,1976,day dad say lov lik son run dad emot deencrypt machin act pretty nic,1,2.0,0.0,0.0
1976,1977,mob boss find someon crew undercov cop ev real it vito spaghett mam mia way,1,1.58,1.0,0.8
1977,1978,vietnames friend get marry common last nam neith nee chang anyth could say nguyennguy situ,1,3.2,1.0,1.2
1978,1979,nee buy anyth black friday want get fistfight bed bath beyond feel al,1,2.68,0.0,0.35
1979,1980,peopl w thyroid problem may nee avoid peanut contain goitrog subst interf w funct thyroid,0,,,0.0
1980,1981,plac eg cold wat flo eat spoil fresh eg sink rot eg flo,0,,,0.0
1981,1982,read convers post gay pal twit pick petty fight gossip insinu neg vib dram hap mat let us get real sery dear bro,0,,,1.55
1982,1983,wom shoot youtub headquart fir 20 shoot ind 4 peopl look lik mass shoot anoth thing ad list thing men bet wom,1,1.42,0.0,3.5
1983,1984,find toast waterproof shock,1,2.4,0.0,0.3
1984,1985,throw whenev hear jok gag reflex,1,2.3,1.0,0.0
1985,1986,togeth build saf individ campus build healthy socy tobacco fre hbcu mak smok hist,0,,,0.2
1986,1987,homeless lady agree let tak hom understand get piss load cardboard box pickup truck,1,2.25,0.0,1.4
1987,1988,viol lawsuit common everyon happy cas clos,1,2.0,1.0,0.15
1988,1989,wif chest freez common extery hot cold ic insid,1,1.95,0.0,0.7
1989,1990,congrat partn aidil hil ye feat memb spotlight hel network keep good work,0,,,0.0
1990,1991,pract preach mak hypocrit long preach hypocrisy,1,2.06,0.0,0.15
1991,1992,rereleas aveng endgam extr foot disney execut swim money,1,2.0,1.0,0.05
1992,1993,look improv tim man skil fal stair lot fast walk sav precy second every trip light,1,2.53,0.0,0.0
1993,1994,count ag friend year count lif smil tear,0,,,0.0
1994,1995,twit 99 sup angry peopl see angry peopl lik lot bet ten year ago 97 peopl angry,1,1.94,0.0,0.1
1995,1996,hear depress plumb go shit,1,2.63,0.0,0.15
1996,1997,know day week suppos seem quarantin somehow saturday sunday stil feel lik weekend hat weekend,1,1.25,0.0,0.0
1997,1998,group hermit crab find empty form lin smallest largest find crab fit crab follow get mov siz wel,0,,,0.0
1998,1999,friend mak hurt remark choos wear mit rath glov lik point fing,1,2.8,1.0,0.0
1999,2000,diff blond mosquito on stop suck slap blond,1,2.15,1.0,2.6
2000,2001,germ man wom sex be walk be shout gross turn away germ man look toward smil say dank,1,1.25,1.0,0.25
2001,2002,wait com around ask quest menu favorit on ask kind pap mad,1,2.6,1.0,0.0
2002,2003,kayak reduc stress watch ur boat mov wat sky amongst green ur effort relax kayak,0,,,0.0
2003,2004,pretty soon plac abl buy conf flag black market oh irony,1,2.33,0.0,1.65
2004,2005,2017 pol germ city frankfurt find car belong 76yearold man forget park 20 year ear,1,1.87,0.0,0.05
2005,2006,mom rec buy jes shap flashlight ask say whenev someon say see lik let jes light path,1,2.5,0.0,0.35
2006,2007,get lay land grind undernea shift knock feet,0,,,0.0
2007,2008,might redneck someon shout hoedown girlfriend hit flo,1,2.68,1.0,1.1
2008,2009,wif sexy thing lik pay din coupon sav money,1,2.65,1.0,0.05
2009,2010,say mom fat would wor lot uk,1,2.95,1.0,1.95
2010,2011,wif stop tak vac kid tak expend nightm,1,2.25,0.0,0.2
2011,2012,hat nee dram lik oxyg stay posit alway tak brea away,0,,,0.05
2012,2013,pharaoh us keep baby quiet egypt dummy,1,1.53,1.0,0.15
2013,2014,thesaur eat breakfast synonym rol,1,3.1,1.0,0.25
2014,2015,burn pizz froz beer pregn girlfriend common on dumbass nev pul tim,1,2.4,1.0,1.4
2015,2016,wrong think could someth real envy,0,,,0.0
2016,2017,jam michael tyl get rol gunth barist friend extr act know us cappuccino machin would go play charact 148 show 236 episod stil receiv resid work show,0,,,0.0
2017,2018,many avenu frant germ soldy lik march shad,1,1.15,0.0,1.05
2018,2019,mex dog say hello jap konnichihuahu,1,2.5,1.0,0.65
2019,2020,know somewh jes get lot sur jes on fac hold arm go lik,1,2.16,0.0,0.75
2020,2021,mex princess ask sist tijuan build snowm,1,1.56,0.0,1.25
2021,2022,norway largest weal fund world valu 1 tril spend 3 valu year conserv fut gen,0,,,0.0
2022,2023,hon bday drop favorit on lip synt,0,,,0.0
2023,2024,careless lif slit wrist careless,0,,,0.7
2024,2025,inv glass let us mak on thing clear,1,2.95,0.0,0.0
2025,2026,columb ind nat be ind wrong plac lol columb hah nat be real tho,1,2.11,1.0,0.9
2026,2027,mak maj decid car lif fin etc dai bas becom complet paralys choos eat lunch,1,2.38,0.0,0.0
2027,2028,cal mex dessert sink flanboy,1,1.5,0.0,0.95
2028,2029,farm would meas height head tomato,1,2.45,0.0,0.0
2029,2030,chew bite 12 tim prev ov giv stomach tim real eat weight loss,0,,,0.0
2030,2031,black peopl nightm kil on dream,1,1.4,0.0,3.1
2031,2032,stev irwin nam daught bind irwin on favorit crocodil austral zoo,0,,,0.0
2032,2033,flavanoid cal phloridzin find appl may protect postmenopaus wom osteoporos may also increas bon dens,0,,,0.0
2033,2034,anyon 55 80 sign hist smok screen lung cant cov obamac,0,,,0.15
2034,2035,car say lov leon lew,0,,,0.0
2035,2036,funda christian favorit typ car convert,1,1.85,0.0,0.75
2036,2037,lif lik socc mom sign expect try best ev though hat fuck socc,1,3.06,0.0,0.25
2037,2038,lov bulletproof on shoot pierc veil,0,,,0.05
2038,2039,sand secondmost wid us nat resourc world freshw,0,,,0.0
2039,2040,isol homophob famy nightm many gay men afric expery on talk altern cho men suff new wav ment il distort tru id,0,,,0.05
2040,2041,brain 90 mad wat thu drink wat help think bet alert cont wat brain,0,,,0.0
2041,2042,peak pow pablo escob bring estim 420 mil revenu every week,0,,,0.0
2042,2043,don lat mad lif bet,0,,,0.15
2043,2044,wif angel lucky pal on stil al,1,2.8,0.0,1.05
2044,2045,real be holiday july 5th buy flag walmart 50,1,2.12,0.0,0.15
2045,2046,bad cho obsess celebr obsess partn,0,,,0.0
2046,2047,common spok phrase week hom scotch tap,1,1.21,1.0,0.0
2047,2048,hap eat bean on tear gas,1,2.95,1.0,0.0
2048,2049,rel ful tim job dar apply know commit,0,,,0.15
2049,2050,husband oh weath lov today shal go quick jog wif hahah lov way pronount shal go cak,1,1.75,0.0,0.55
2050,2051,wif mak everyth wood pun couch gre lumb support wif see therap try stop oakey dokey,1,2.05,0.0,0.0
2051,2052,blind dat lik real good look hand mak sex read hand hey blind,1,1.6,0.0,0.6
2052,2053,cal rud germ deutsch bag,1,2.85,0.0,1.35
2053,2054,mad company disgu land min pray mat prophet roof,1,2.8,1.0,1.9
2054,2055,mayb old wind teach us someth remind us overcom,0,,,0.0
2055,2056,hel kel masturb on hand could moan,1,2.37,0.0,2.7
2056,2057,hon nin pop tony mc dad many black tran peopl murd statesanct viol okr project ded 15000 cre nin pop ment heal recovery fund tony mcdade ment heal recovery fund thread,0,,,0.0
2057,2058,disco bal say depress toilet party poop,1,2.25,0.0,0.1
2058,2059,katheryn hudson del bop tim around cry lat teary ey tuck cur fav,0,,,0.0
2059,2060,see pain see pleas nobody body body us body togeth zayn malik,0,,,0.0
2060,2061,peopl leg terr triv alway stump,1,2.45,1.0,2.0
2061,2062,right on rememb wrong on forget,0,,,0.0
2062,2063,know girlfriend get fat fit wif cloth,1,2.05,1.0,2.2
2063,2064,wif get rid clut see kid stand street mean mak cut year,1,3.2,0.0,0.2
2064,2065,girl loan off furnit stor giv zero interest 3 year,1,2.65,1.0,0.45
2065,2066,thank wond bday lov yesterday fil 2 boy truck dinosa good day sur,0,,,0.0
2066,2067,cal greedy lesb bush hog,1,1.89,1.0,2.65
2067,2068,elizabe tayl want lat fun coffin ar 15 minut annount start tim,1,1.86,1.0,0.35
2068,2069,show catch pred cancel part texa district attorney catch exchang photo someon pos 13yearold boy man shoot pol nbc camer crew ent hom,0,,,0.45
2069,2070,snail say rid turtl back whe,1,1.95,1.0,0.0
2070,2071,guy ask girlfriend mak feel awesom sad tim girlfriend friend biggest pen,1,3.15,1.0,0.55
2071,2072,dr sarah vinson psychy execut edit black magazin cult tail onlin print produc focus black ment heal broad defin,0,,,0.0
2072,2073,tongu slip ask wif pass milk breakfast accid say fuck an ruin fuck lif,1,2.4,1.0,1.3
2073,2074,say go someth real go,1,1.38,0.0,0.15
2074,2075,littl mountain say big mountain hi cliff,1,1.83,0.0,0.0
2075,2076,walk room light want anyon know 1 get tak hom afraid,0,,,0.4
2076,2077,mal squirrel gay cuz lov nut,1,2.4,1.0,1.55
2077,2078,nee gift man everyth try giv scorn look,1,1.8,0.0,0.05
2078,2079,mass fac ic cub mad chamomil tea help clos por mak skin glow us on ic cub day skin,0,,,0.0
2079,2080,doct fin exam bad new box kil mad could pun doct look glass,1,2.42,1.0,0.0
2080,2081,three men argu wheth know jew israel hebrew would say argu semit,1,2.68,1.0,1.3
2081,2082,lord help rememb noth go hap today togeth handl be,0,,,0.0
2082,2083,turn wind wisdom,0,,,0.0
2083,2084,nam pi mom stand top stair yel 3141592653589793238462643383279502884197169399375105820974944592307816406286 get troubl,1,2.4,0.0,0.0
2084,2085,prov god real tim prov dog run viol as street gang asleep,1,3.26,1.0,0.85
2085,2086,slow ag wrinkl salmon high astaxanthin carotenoid improv skin elast wrinkl heal ag,0,,,0.0
2086,2087,nic request thank best,0,,,0.0
2087,2088,spec thank audy memb let us spray purpl goo hero 200thepisode,0,,,0.1
2088,2089,blood don clin want don plasm mak tvs,1,2.58,1.0,0.0
2089,2090,heal educ tend bet receiv peopl overal educ mmh mchat,0,,,0.25
2090,2091,spoon typ hugh body clos but touch intim part proof high sex appetit,0,,,0.5
2091,2092,ev break wom heart get on break fuck bon get 200,1,1.63,0.0,3.6
2092,2093,god cre us say cre good fat slim muscul pot bel good god ey nev conform world definit beauty els suff depress infery complex,0,,,0.0
2093,2094,cre emot convers wom us story us plenty emot word let story word bring feel interest,0,,,0.15
2094,2095,joseph confront mary joseph mary hear prostitut body town mary worry joseph try mak littl prophet,1,2.8,1.0,2.05
2095,2096,think wif habit walk sleep every morn find sleep someon els bed,1,2.47,1.0,0.25
2096,2097,hors insomn keep everyon awak nightm,1,2.75,1.0,0.0
2097,2098,jeff bezo find amazon becom first person ev net wor 200 bil,0,,,0.1
2098,2099,tongu scraper rub edg best get rid bad brea lov wisdom tongu cle brand try find 1 mad rub,0,,,0.25
2099,2100,man commit suicid get sid,1,1.65,0.0,2.6
2100,2101,serg smi see camoufl pract today priv smi thank sir,1,2.9,0.0,0.0
2101,2102,girlfriend talk say ruin birthday sur ev know birthday,1,2.9,0.0,0.05
2102,2103,wak confus sunday morn 20s hap last night must pass drink much wak confus sunday morn 40s hap last night must pass watch infomerc tv,1,1.78,0.0,0.0
2103,2104,nev regret good mem bad expery,0,,,0.0
2104,2105,many scandinav par adam giv inf fresh air every day let tak nap outsid ev freez weath par report baby tak long deep nap sleep comfort bundl outsid cold,0,,,0.25
2105,2106,dream wish heart mak cinderell,0,,,0.0
2106,2107,hah ad lib ad lib lov leav show,0,,,0.0
2107,2108,appl ceo annount gay samsung ceo annount gay wat resist,1,3.15,1.0,1.2
2108,2109,fig many masturbationrel injury guard angel cov ey,1,1.8,0.0,0.7
2109,2110,wow first think den quaid thing mistak talk randy quaid nop guess whol famy littl funny,0,,,0.35
2110,2111,cannib dump girlfriend wip ass,1,1.9,1.0,1.45
2111,2112,fin stop drink good drink evil,1,3.2,0.0,0.05
2112,2113,say last girlfriend bite slut first meet high sperm count,1,1.85,1.0,2.8
2113,2114,girlfriend decid quit job yogurt company tru nev real lik cult,1,2.82,1.0,0.0
2114,2115,way address tox masculin amongst stud aunty red tweet tea,1,0.7,0.0,0.7
2115,2116,ask pilot would okay sex flight reply giv fly fuck,1,2.95,0.0,0.7
2116,2117,buddy kirk wait anyon spot real blood pour head behind ear take on team thank,1,0.64,0.0,0.05
2117,2118,coff shop japan castl sieg common barista,1,0.7,0.0,0.45
2118,2119,lady multipl person disord shar food friend sharon kar,1,2.1,0.0,1.45
2119,2120,ashley pop girl us gay deserv,0,,,0.35
2120,2121,nev expect nev assum nev ask nev demand let mean hap,0,,,0.25
2121,2122,doct say might die accid consum clay shit brick honest,1,3.1,1.0,0.1
2122,2123,lesb sex concert rock beat sciss,1,2.05,1.0,1.75
2123,2124,wif cry alway cal weird pet nam therap mean ar lat wrong littl hovercraft,1,2.37,1.0,0.25
2124,2125,innov everyth noth remain long eith adapt chang get leave behind,0,,,0.0
2125,2126,think wom stay kitch mean suppos cle rest hous,1,2.05,0.0,3.15
2126,2127,mam evolv flow plant,0,,,0.0
2127,2128,best que film tim,0,,,0.15
2128,2129,coff get cold lik warm 20 second forget microwav,1,3.12,0.0,0.0
2129,2130,wif many sho bedroom look lik outsid mosqu,1,2.32,1.0,1.6
2130,2131,cosm speak saturn ring brief ev rough halfway 200millionyear lifesp lucky ex tim see,0,,,0.0
2131,2132,tak paty singl paty marry,1,1.2,0.0,0.0
2132,2133,tru crim podcast ide husband 2 episod,1,1.42,0.0,0.55
2133,2134,feel overwhelm sad goe somewh alon cry feel overwhelm happy goe somewh alon cry feel confus,1,2.1,0.0,0.0
2134,2135,send pack box fiv doz liqu jug us every let engl alphabet,0,,,0.0
2135,2136,carrot juic rich betacarot antioxid prev cel deg ag process also slow,0,,,0.0
2136,2137,alway apprecy strength,0,,,0.0
2137,2138,damon hoffm dat expert host two tv show today discuss interrac dat pro con limit dat certain rac relig challeng expand on cult view ultim find right person,0,,,0.2
2138,2139,thing learn,0,,,0.0
2139,2140,watch bohem rhapsody sad think freddy mercury die aid becam tre watch rocketm sad think aid tre,1,1.59,0.0,1.8
2140,2141,would lik remind reg for ment heal stat black americ host black psychy americ,0,,,0.2
2141,2142,many peopl den tak chang light bulb noth wrong light bulb,1,2.4,1.0,0.0
2142,2143,stil cal show fash lat wear swe pant tshirt spaghett stain,1,2.21,1.0,0.0
2143,2144,walk away,0,,,0.25
2144,2145,thank join us tonight quest concern pleas dm us us hasht aunty red tweet tea,0,,,0.0
2145,2146,two deer walk gay bar on turn say believ blow thirty buck,1,2.75,1.0,1.15
2146,2147,dat ap profil box reg vot yesno,1,2.0,1.0,0.0
2147,2148,go starbuck nic soc plac go want alcohol stil want spend 7 buck drink,1,2.71,0.0,0.0
2148,2149,mormon lik muslim lik christians christians notforprophet org,1,1.89,1.0,1.05
2149,2150,doct accid prescrib paty lax instead cough syrup three day lat paty com checkup doct ask wel stil cough paty reply afraid,1,2.8,1.0,0.0
2150,2151,good way forget troubl help oth,0,,,0.0
2151,2152,son purnel vivid recount story virgin hal spy play pivot rol help al win wwi,0,,,0.0
2152,2153,anim disney snow whit troubl mak cheek red without look lik clown fem staff memb produc suggest us real blush anim cel snow whit wear real makeup every scen,0,,,0.0
2153,2154,would captain americ cal fight vietnam man,1,1.33,0.0,0.15
2154,2155,fat peopl liv obec,1,2.05,0.0,1.9
2155,2156,fiv minut walk hous bar 40 minut walk bar hous diff stag,1,2.89,0.0,0.05
2156,2157,peac abs war peac feel com rememb lord,0,,,0.15
2157,2158,nintendo charact mario nam mario seg company landlord 1981 stat mad publ stil wait royal check pass away octob 2018,0,,,0.05
2158,2159,son think real smart goe school cam hom yesterday boast on food mak cry throw coconut head,1,3.05,0.0,0.35
2159,2160,confess gym saw guy run ful spee treadmil read book could believ see take video lady front desk confront lie say selfy,1,1.5,0.0,0.25
2160,2161,moth two feel lik protest howev want act way impact toward soc just mov aunty red tweet tea,0,,,0.1
2161,2162,play hard play fast play loos fre play tomorrow,0,,,0.0
2162,2163,new rel thing worry los don dat keep autonom person lifestyl intact rel aunty red tweet tea,0,,,0.05
2163,2164,nas employ chief sniff whos job smel every item fly spac,1,2.0,0.0,0.0
2164,2165,ask wif on say ye oth least sev eight,1,3.3,0.0,0.7
2165,2166,yo presid grov cleveland buy baby carry inf becam wif 22 year lat,1,1.75,0.0,0.45
2166,2167,find friend secret lif priest alt ego,1,2.84,1.0,0.3
2167,2168,diff snip bad eyesight constip owl on shoot hit hoot shit,1,2.5,0.0,0.25
2168,2169,potato chip brag less fat think understand peopl eat,1,2.37,1.0,0.85
2169,2170,rel set ton every rel,0,,,0.0
2170,2171,tel diff ind afr eleph on eleph,1,1.95,1.0,1.6
2171,2172,person think beekeep suit ug hel hey beauty ey beehold,1,3.06,1.0,0.0
2172,2173,glad abl reconnect facebook 20 year anyway invit lik pag sel lot,1,2.92,0.0,0.2
2173,2174,hippo abl sleep underw util reflex allow surfac tak brea sink without wak,0,,,0.0
2174,2175,on tel tal sign guy scarc mindset com wom say diff oth,0,,,0.1
2175,2176,know lov real way feel on direct,0,,,0.15
2176,2177,many germ tak screw lightbulb non engin correct,1,1.6,0.0,0.5
2177,2178,leave steph hawk lik 8 voic mail mess real would pick every tim,1,2.32,1.0,1.4
2178,2179,get addict certain kind sad goty,0,,,0.0
2179,2180,fac los day inst wond hel mak us hold togeth,0,,,0.0
2180,2181,apply new job stat il dis narcolepsy touret sleep job anybody tri wak tel fuck,1,2.65,0.0,1.25
2181,2182,rap j col gradu high school 42 gpa acceiv scholarship st john univers presid panafr stud coalit colleg gradu magn cum laud degr commun busy,0,,,0.0
2182,2183,hypochondriac mean selfdiagnos know someth wrong,1,1.94,1.0,0.25
2183,2184,girlfriend cal select hear pref cal dram filt,1,3.26,0.0,0.8
2184,2185,also pay doorm lie tell delivery guy ord two peopl,1,1.95,0.0,0.15
2185,2186,5 day til christmas hop wrap christmas tre,1,2.15,1.0,0.0
2186,2187,tru meas loud preach,0,,,0.0
2187,2188,black whit black whit black whit green skunk rol hil pickl mou,1,2.47,1.0,0.2
2188,2189,undress word saw spid bra,1,2.6,1.0,0.0
2189,2190,understand nev chang imagin dragon,0,,,0.0
2190,2191,week 4 ment heal aw mon 2012 mhm2012 send tweet rel 2 depress unipol depress bipol depress,0,,,0.1
2191,2192,lie detect test pair pant put start fir,1,2.69,1.0,0.0
2192,2193,prom cam on mex party rac would end,1,1.33,0.0,0.65
2193,2194,ask look fat reply noo autocorrect moo,1,3.5,1.0,1.4
2194,2195,peopl complain pap straw mcdonalds tip tak lid drink lik fuck grow,1,2.07,0.0,1.1
2195,2196,think buy big bed bed room less bedroom,1,2.33,0.0,0.0
2196,2197,giv good achiev gre,0,,,0.0
2197,2198,80 year old lesb tast lik depend,1,2.25,1.0,2.55
2198,2199,nor kor draw lin wel suprem rul,1,3.05,1.0,0.9
2199,2200,boss fir mak many as jok end kore chin find new job,1,1.55,0.0,1.1
2200,2201,main reason join many religy cult hard tim turn refresh cup koolaid,1,2.5,1.0,0.85
2201,2202,die man look wif ey say honey go someth nee tel reply already know dear poison,1,3.5,0.0,0.35
2202,2203,honey mad new app old lady fight libr ghost,1,2.45,1.0,0.3
2203,2204,yo mam ug fath tak work kiss goodby,1,2.45,1.0,1.4
2204,2205,idk stand light everyon ask say know,1,3.06,0.0,0.0
2205,2206,techn 24 hour day 23 hour 56 minut 4 second day,0,,,0.0
2206,2207,ye fem,0,,,0.15
2207,2208,veg rough sex get artichok,1,2.1,1.0,0.5
2208,2209,paul newm friend lov homemad salad dress much start newm newm nev take person pay company don 100 profit char 1992 ten year first produc sell 50 mil don,0,,,0.0
2209,2210,cinnamon help diabet half spoon day reduc blood sug level accord us research diabet heal cinnamon,0,,,0.15
2210,2211,take girl starbuck forget nam,1,2.11,0.0,0.15
2211,2212,on lesb vampir say pad,1,2.05,1.0,1.55
2212,2213,wif block facebook post many bird pun wel touc play gam,1,2.74,1.0,0.1
2213,2214,leave kne nev commit crim say felony,1,2.3,0.0,0.1
2214,2215,hey architect nerd sit lik might ant wood carv would plac atop newel post see old hous ceram fig statuet wel crazy saturday night,0,,,0.0
2215,2216,as kitch afr liv room bathroom bathroom europ,1,1.8,1.0,0.15
2216,2217,want hear dirty jok hors fel mud crazy lesb hat hors put strap fuck til die,1,1.5,1.0,3.6
2217,2218,dad tell son stop masturb go blind tell dad,1,3.85,0.0,1.0
2218,2219,2013 sci impl hum brain cel mic mic stat subst smart control mic cre mousehum hybrid inject baby mic mat hum astrocyt cel complet take brain mic,0,,,0.4
2219,2220,tak ful adv biggest hat perhap off insight nev would see,0,,,0.0
2220,2221,janit lady apart build ask dat say wee tell high maint wom,1,2.65,1.0,0.35
2221,2222,diff be teen girl muslim teen girl be teen girl get ston sex sorry,1,2.5,1.0,3.55
2222,2223,rac group gay group lesb think get first lesb get licketysplit gay stil pack shit,1,2.05,0.0,2.85
2223,2224,train mind stronger feel,0,,,0.0
2224,2225,best part redneck famy fight makeup sex,1,2.42,1.0,1.55
2225,2226,q could blond writ numb elev know on cam first,1,2.6,1.0,1.2
2226,2227,enslav emancip without plan illud freedom dr gril black mind mat,0,,,0.0
2227,2228,think entir famy rac dat whit wom ev bring hom meet famy wif kid nev ev want speak,1,3.0,0.0,1.2
2228,2229,dat mayb go struggle get straw juic pouch,1,2.11,1.0,0.0
2229,2230,bathtub revers cano,1,2.3,1.0,0.0
2230,2231,word lun com latin word lunatic believ ful moon caus temp ins,0,,,0.0
2231,2232,hat bipol gre,1,2.6,1.0,0.6
2232,2233,try cancel 24hour fit memb hold talk someon 30mins long think til someon pick,0,,,0.0
2233,2234,emot emancip overcom lie whit suprem black infery dr gril black mind mat,0,,,0.2
2234,2235,first dat lov travel foreign country try impress visit republ banan,1,2.53,1.0,0.0
2235,2236,lov jew com nev ham,1,2.1,0.0,0.55
2236,2237,janit apart complex ask want smok wee say deal high maint wom,1,2.85,0.0,0.2
2237,2238,research discov bat address individ oft get argu,0,,,0.0
2238,2239,eat girl lik memb maf on slip tongu deep shit,1,2.89,0.0,2.35
2239,2240,drink muslim say drink muslim mohammad,1,2.1,1.0,2.75
2240,2241,look respect cult mand let us see fac also real want see mand handsom fac mand,0,,,0.1
2241,2242,wif leave fisherm poor guy stil reel,1,2.45,0.0,0.15
2242,2243,nee littl bite man nee lot knowledg abdullah ibn mubarak,0,,,0.0
2243,2244,andrew fereb find knowledg men prevy episod podcast go talk develop grow mindset apply skil approach girl approach girl act feel glad,0,,,0.5
2244,2245,sci evid confirm breakfast import meal day,0,,,0.0
2245,2246,wok crazy ass dream,0,,,0.05
2246,2247,yesterday clev want chang world today wis chang,0,,,0.0
2247,2248,wif real good put toddl bed goe sleep right away know bet tel workday,1,2.37,0.0,0.35
2248,2249,deaf girlfriend tell nee talk good sign,1,2.15,0.0,0.85
2249,2250,fart sleep nev hold ev hap work meet conf room,1,2.7,1.0,0.2
2250,2251,bet anyon giv damn anyon think team buddy,0,,,0.1
2251,2252,starv black man put foodstamp next work boot,1,1.55,0.0,4.1
2252,2253,black girl twerk hisp girl hip rol ind girl bel dant whit girl watch,1,2.11,0.0,1.8
2253,2254,black wom wear high heel stop knuckl drag flo,1,1.35,0.0,4.3
2254,2255,watch docu ful coop subject mad look horr nev see remark,0,,,0.0
2255,2256,doct off doct seem problem find hug crack but laugh high fiv,1,2.37,0.0,0.05
2256,2257,problem que peopl ind stil find difficult quick loc hiv heal leg serv ev sensit around serv provid que friend g 4 e,0,,,1.05
2257,2258,brok girlfriend would go gym work,1,2.95,0.0,0.05
2258,2259,die everyday wait christina perr,0,,,0.0
2259,2260,estim 7 men suff parures anxy disord mak imposs urin peopl nearby,0,,,0.0
2260,2261,year keep kil wrong peopl,1,2.3,1.0,1.05
2261,2262,wak on day look around recogn anyth anyth,0,,,0.0
2262,2263,sant watch shoot wasp nest bow arrow cross nam nic list ad fuck badass list,1,2.05,0.0,0.5
2263,2264,mag favorit mex dish tostad,1,2.11,1.0,0.45
2264,2265,gangst parad prof stevy wond would allow prof song sampl work,0,,,0.0
2265,2266,scal say gain 5 pound prob wear wif nak wif heavy deod,1,2.45,0.0,0.1
2266,2267,ask girl scary rememb prob nerv man tak lead ask,0,,,0.0
2267,2268,ohan alway lov lilo stitch,0,,,0.0
2268,2269,cal ghost booby paranorm entitty,1,3.58,1.0,0.4
2269,2270,yesterday purchas world map gav wif dart say throw wherev land tak holiday turn spend three week behind fridg,1,3.25,1.0,0.05
2270,2271,long tim ago think sod jok would shar afraid think would fal flat,1,2.25,0.0,0.2
2271,2272,alway good fig die first movy sometim direct fuck cast many black peopl,1,2.67,0.0,1.75
2272,2273,many muslim tak screw lightbulb sorry com unavail jok,1,1.2,1.0,2.9
2273,2274,lik wom lik lik coff hot crotch,1,1.5,0.0,2.3
2274,2275,mattress shop look someth real comfort lay awak worry thing nev hap,1,2.63,0.0,0.0
2275,2276,wear croc lik get blowjob guy feel gre look real gay,1,2.16,1.0,2.25
2276,2277,mankind leave 96 bag fec urin vomit moon,0,,,0.0
2277,2278,liv tim go muse belong muse,1,1.92,0.0,0.1
2278,2279,happy superso sunday everyon hop enjoy extr hr get ready bunch ah mom com sss facebook,0,,,0.0
2279,2280,hap eg every tim look becom eg sight,1,2.16,0.0,0.0
