,id,text,is_humor,humor_rating,humor_controversy,offense_rating
0,1,ten best stat nobody ev com clos elev walk room ten oh shit,1,2.42,1.0,0.2
1,2,man insert advert class wif want next day receiv 1000 reply read min fre delivery also avail door step,1,2.5,1.0,1.1
2,3,many men tak op beer non op tim bring couch,1,1.95,0.0,2.4
3,4,tell mom hit 1200 twit follow point broth own hous want sev collect ag oh,1,2.11,1.0,0.0
4,5,ros dead lov fak wed bas fun cak,1,2.78,0.0,0.1
5,6,trabajo span word work com latin term trepali mean tort,0,,,0.0
6,7,enrol skil train extr curricul act ad shap weekend afterwork schedule day pass expos blind lov obsess month cool men,0,,,0.1
7,8,origin tru on kind also hold glass whit win lov laugh,1,1.79,1.0,0.0
8,9,men ejac 21 tim mon low risk prost cant ejac four sev tim mon accord research harvard th chan school publ heal,0,,,0.05
9,10,get real angry today noth go tak word,0,,,0.15
10,11,dog mexico nam frid sav liv 12 peopl trap rubbl earthquak 2017 ident tot 52 body throughout car consid nat heroin off retir,0,,,0.0
11,12,diff mormon man muslim man mormon man get 72 virgin kil,1,2.2,0.0,2.95
12,13,stop cal 911 run toilet pap ye run toilet pap dial 911 numb 922 steph colbert,1,1.5,1.0,0.0
13,14,march streets shout peopl civil disobedy drink involunt 72hour hold,1,2.16,1.0,0.2
14,15,balsam vineg help slow appear ag sign healthy healthy food heal,0,,,0.0
15,16,stand struggle shar story heal heal someon els iyanl vanz,0,,,0.0
16,17,grief com tim everyon way best best anyon try honesty,0,,,0.0
17,18,mak send creepy ad con two con adult rid tandem kayak,1,1.78,1.0,0.2
18,19,bet lif goe work hard noth tak grant,0,,,0.15
19,20,antm shrink mak spac atom smal go subatom guy stal next shut fuck,1,1.55,1.0,0.9
20,21,say pub get long get erect look lik pinocchio gon join talib,1,2.45,0.0,1.8
21,22,act gay account twit yet spit hat fellow gay dud publ sham,0,,,1.0
22,23,spend long tim focus fut plan work toward point start real lif hap,0,,,0.0
23,24,girlfriend lik squ root 100 10 imagin,1,2.45,0.0,0.05
24,25,fact condit doct cal chromatica sick,0,,,0.15
25,26,wif leave say mad meal everyth intend mak eat word,1,2.65,1.0,0.15
26,27,chin select baby nam chuck tin stair ping wong ching pang,1,2.4,1.0,3.8
27,28,reliev go doct look larg mol chest turn cant most dollop bbq sauc mol,1,2.89,0.0,0.25
28,29,fath trust anyon fact say tel,1,2.95,0.0,0.0
29,30,specim mam mia it astronaut,1,1.21,0.0,0.85
30,31,ask pretty young homeless wom could tak hom say ye big smil look fac soon chang walk cardboard box,1,2.58,1.0,2.15
31,32,vasectom kid get hom stil,1,3.21,0.0,0.15
32,33,candy can candy wheelchair candy walk etc mobl aid feel discrimin,1,2.3,0.0,1.35
33,34,bil joel sel front row seat show giv away random peopl cheap seat real fan front instead wealthy peopl,0,,,0.2
34,35,learn scar oth,0,,,0.05
35,36,damn girl nam must ebol think spread,1,1.85,0.0,1.95
36,37,interview posit becom blacksmi ask ev shoo hors say tell donkey fuck,1,2.53,0.0,0.2
37,38,anybody eat tid pod idiot could go costco get gen brand half pric,1,2.95,1.0,0.5
38,39,mayb heart stop beat hurt much param,0,,,0.0
39,40,meth us toplin antidepress throughout 1930s 1950s gordon al los angel chem pat med inject becam talk describ feel wel,0,,,0.0
40,41,get say miss next week midseason fin queen sug,0,,,0.0
41,42,bik nam gang bik act real tal writ nev enco child pursu gift find commun rough loy group guy hel angel bik damn man ye,1,1.76,0.0,0.2
42,43,bond defy dist tim log tie simply mean,0,,,0.0
43,44,thoma jefferson help popul mac chees americ would serv din guest presid ev recip,0,,,0.0
44,45,whoev find friend find treas car,0,,,0.0
45,46,cal bad brea sneak ninjavit,1,2.45,1.0,0.0
46,47,gay roost say anycockledoooooo rofl,1,2.0,1.0,2.0
47,48,tel it car flat tir dago wop wop wop,1,1.5,1.0,2.0
48,49,help thing us aw fuel fuel teach oth help bet navig system bet impact corn world,0,,,0.0
49,50,nev fin anyth black belt part art,1,2.75,1.0,0.0
50,51,2018 missour deer poach ord watch bamb mon entir yearlong prison send,1,1.71,0.0,0.2
51,52,two meth head start rel consid spee dat meth around,1,2.9,1.0,0.9
52,53,kim jong un lov book glory read,1,1.68,0.0,0.8
53,54,colleg us liv housebo start dat girl next door ev drift apart,1,2.95,0.0,0.25
54,55,mat new adv embark stil bring every new begin diff,0,,,0.0
55,56,unbeliev part sesam street show 8 foot bird on grouch whol neighb,1,2.89,0.0,0.0
56,57,peac court obey law respect everyon someon put hand send cemetery malcolm x,0,,,0.4
57,58,ten year dea best friend fin op pack leave confus empty box wond mistak smel fart laugh ghost rest peac,1,2.5,0.0,0.3
58,59,choos word wis ask angel eras,0,,,0.0
59,60,giv enough credit dad spend wak hour contin turn light adjust thermost real unsung hero fight clim chang reduc hum carbon footprint,1,2.27,0.0,0.0
60,61,rom scholar marc terenti varro predict microbiolog 2000 year ago wrot breed certain minut cre see ey flo air ent body mou nos sery diseas,0,,,0.0
61,62,smart man know lov forrest gump,0,,,0.0
62,63,hel kel walk bar tabl stool,1,3.15,1.0,2.1
63,64,year 2125 tour be ruin zomby fat immedy threat,1,2.58,1.0,0.6
64,65,tobacco industry giv ton money group lik unit negro colleg fund buy sil greatest lead,0,,,0.25
65,66,26yearold wom cur unemploy feel hopeless adv giv way set track lif aunty red tweet tea,0,,,0.0
66,67,girlfriend get new tattoo in thigh seashel put ear smel oc,1,2.6,0.0,1.2
67,68,excit ting hap say noth yet stay tun,0,,,0.0
68,69,believ 125 bibl mean eighth,1,2.4,1.0,0.5
69,70,wif find pretzel hair at know could lov,1,2.71,0.0,0.05
70,71,be good comput troubleshoot,1,2.16,1.0,1.0
71,72,think biggest threat black ment heal,0,,,0.15
72,73,replac statu wast stat fund wast opportun right thing,0,,,0.0
73,74,want watch chick flick chick eat chickfil sunday,1,1.8,1.0,0.05
74,75,go petit tro tonight delicy man though sit high stool din tough old girl,1,1.36,0.0,0.1
75,76,meet girl say lik imagin dragon ask could imagin dragon nut across chin,1,1.95,0.0,3.1
76,77,avoid teacoff meal tannin teacoff prev absorb nutry tea halv iron get orang juic doubl,0,,,0.0
77,78,wait inv pleas robot lifelik sex,1,2.8,1.0,0.4
78,79,fart both wif yel releas krak right,1,2.6,0.0,0.0
79,80,wif disappoint find nicknam colleg lov machin suck ten,1,2.85,1.0,0.35
80,81,janu monday month,1,2.43,0.0,0.0
81,82,arnold schwarzenegger allow dub rol movy termin germ langu acc consid rur standard would mak sens machin fut sound lik middl nowh,0,,,0.0
82,83,wok pinch nerv back pain bad ev wors sick feel betray trust friend bed,1,2.42,0.0,0.1
83,84,twit nee convers us ord success twit clos twit account,1,2.31,0.0,0.0
84,85,lumberjack go mag forest cut tre get start swing tre sud shout wait talk tre lumberjack laugh say dialog,1,3.58,1.0,0.0
85,86,childr breath childr play dr cheryl gril black mind mat,0,,,0.25
86,87,com point lif nee someon speak someon lov mak feel lov reach point,0,,,0.0
87,88,know suck fal guy right fal anyway think might turn diff,0,,,0.0
88,89,barack obam goe costum party giv wif piggyback rid someon ask dress respond snail mshe back,1,3.25,1.0,0.25
89,90,learn peopl cle sink regul,0,,,0.0
90,91,angry facebook believ would leak inform sign without read leg docu volunt person detail lif let track internet act could,1,2.79,1.0,0.05
91,92,act hugh laury real sev clin depress felt neith excit fright see two car collid explod front char demolit derby com boredom appropry respons explod car,0,,,0.05
92,93,brad pit lin deod cal brad pit,1,2.55,1.0,0.0
93,94,celebr get 300k twit go hold virt meet greet instagram liv 630 est tun request join get on quest screen grab pict,0,,,0.0
94,95,selfwor stem first think worthy,0,,,0.0
95,96,cal 2000 mockingbird two kilomockingbird credit goe old phys book,1,2.8,1.0,0.45
96,97,bird fly sou wint far walk,1,2.5,0.0,0.0
97,98,first dat want man giv butterf pul shoebox preserv dead butterf luck,1,2.79,1.0,0.0
98,99,us get upset on twit account go way shad const know everyth would ev don read every artic crit real watch everyth biggest fan,1,2.58,1.0,0.05
99,100,cal ind top tv show dan singh sit,1,1.74,0.0,1.55
100,101,last night wif watch 2 hour cook show hug go bed pretty sur friend zon,1,2.07,1.0,0.0
101,102,girlfriend leave not fridg work go mom hous op fridg light cam beer cold hel talk,1,3.0,1.0,0.35
102,103,find difficult que black greek let org aunty red tweet tea,1,0.27,0.0,0.95
103,104,lavend ess oil calm scent reduc migrain headach anxy nerv tend stress increas ment act,0,,,0.0
104,105,gay men alway first checkout hotel shit pack night,1,2.1,1.0,3.45
105,106,girlfriend fath pretty religy say could mak lov rath disappoint extrem handsom,1,3.25,0.0,0.15
106,107,estim 200 galaxy know univers every hum ear,0,,,0.0
107,108,someon sue canad dry ging al contain ging would lik form annount lawsuit pand express,1,2.75,1.0,0.25
108,109,alway rememb stil struggle,0,,,0.0
109,110,group therapy ins asyl therap let us talk desir hurt peopl psycho 1 want kil peopl psycho 2 want eat peopl psycho 3 want post gam throne spoil psycho 1 2 wrong real mess,1,2.74,1.0,0.45
110,111,baby yod delight ant yod ench teen yod friggin imposs,1,1.0,0.0,0.0
111,112,wis alway quiet know,0,,,0.0
112,113,research provid colleg find tim becom bet friend peopl simil level soc anxy,0,,,0.1
113,114,tim fulfil dream market lin art antifreez,1,1.59,1.0,0.0
114,115,real enjoy jimcarrey memoir lik jim book wild com inv subvert mad prim compress pap pulp,1,2.05,0.0,0.35
115,116,oh god lik spaghett guy dr boyard want tre snak bite want talk broth,1,2.11,1.0,0.1
116,117,saw sign shop window read would rath 1000 muslim custom on us soldy shop fun direct crack,1,2.0,0.0,3.8
117,118,boy bear ind chin ir it grandmoth could settl nam hit nam rav lee,1,2.47,1.0,1.2
118,119,cal sad ter cris,1,2.16,1.0,0.85
119,120,resta ask pack leftov food say stuff cheek lik hamst leav,1,1.47,0.0,0.05
120,121,friend ask describ 3 word lazy,1,2.85,1.0,0.0
121,122,parody mand mind whol costum mindytyp stuff,1,0.56,0.0,0.2
122,123,cowboy giv three pack condom pleas cashy nee pap bag sir cowboy nah purty good lookin,1,3.16,1.0,1.0
123,124,girlfriend dress policewom tell arrest susp good bed 2 minut charg drop due lack evid,1,3.25,1.0,0.15
124,125,hear lady lik bad boy lucky bad everyth,1,2.65,1.0,0.2
125,126,interview greatest weak part deaf interview right would tight,1,1.24,1.0,0.4
126,127,giv com easy us everyth pow,0,,,0.0
127,128,kid moth stop breast fee ask say hey want friend,1,2.75,0.0,0.3
128,129,best chant catch gre tv show nonf ski accid,1,1.95,0.0,0.4
129,130,already someth common every girl see context us start convers respons keep go,0,,,0.0
130,131,girl dress impress guy dress impress girl want impress guy would run around nak day,1,2.75,0.0,0.0
131,132,on gen plant see next gen receiv shad,0,,,0.0
132,133,bedroom wif thing lik put sleep apne mask,1,2.53,1.0,0.15
133,134,wif bliss happy 25 mag year meet,1,3.4,0.0,0.25
134,135,go real rough period work week fault swap tampax sand pap,1,2.42,1.0,0.75
135,136,eid mubarak person want wish bless eid nowaday everyon overwhelm amount imperson mess peopl cop past send get job don anyway wish best 2013 broth abd,0,,,0.0
136,137,stress rec chin thing needl know heroin,1,2.32,1.0,2.8
137,138,hum los weight 80 fat convert carbon dioxid exh lung,0,,,0.25
138,139,peopl real respect wil speak tru,0,,,0.0
139,140,peopl get email print niger get on egypt pharaoh turn pyramid scheme,1,3.0,0.0,0.0
140,141,inv soc med way overwhelm polit tim instead every 4 year elect,1,2.3,0.0,0.0
141,142,hospit doct giv iv drug help pain quest us rom num numb drug doct,1,2.67,0.0,0.05
142,143,grap cry crush win,1,3.4,0.0,0.0
143,144,black wom mak best wiv see bru,1,1.16,0.0,4.7
144,145,fre mint movy the bathroom wif gross eat mint bathroom mou ful mint know,1,2.8,1.0,0.0
145,146,men stop tre baby moth lik crap could happy togeth mean deserv happy,0,,,0.15
146,147,on tim shoot defenseless black guy get arrest imperson off law,1,2.22,0.0,2.6
147,148,town nev chang pop everytim girl get pregn guy leav town,1,2.65,1.0,0.9
148,149,spid keep build web front doorway every day annoy spid hum keep walk web look hil every singl tim remind rebuild thing tomorrow,1,1.95,1.0,0.0
149,150,ban cig flav lik cherry work prev you smok sav young liv ban menthol sav black liv tobacco fre hbcu,0,,,1.5
150,151,wif pack kal quino salad lunch today eat hide bathroom peopl think hipst,1,2.0,0.0,0.2
151,152,form reintroduc group rad bipoc interpret across multipl intersect bring access soc just mov southern californ tim lov hand fight right,0,,,0.1
152,153,engl man ask be lik tea be reply harb,1,2.58,0.0,0.35
153,154,bird chirp chirp chirp on stick kind bird forget cam hoo,1,1.89,1.0,0.0
154,155,steph sondheim get sweet royal jok marry story send clown al happy entertain attorney,0,,,0.0
155,156,believ say week pray louisian hel hap world stop,0,,,0.0
156,157,banana protect ey macul deg build strong bon increas calc absorb heal diet,0,,,0.0
157,158,hard follow clown act girlfriend dat clown start go togeth get pretty big sho fil,1,2.55,0.0,0.0
158,159,girl wear makeup perfum ug smel,1,1.28,0.0,3.1
159,160,girl alway get mad try read shirt fault blind,1,2.63,1.0,0.95
160,161,back tim liv denv alway want heart healthy way start day brisk colorado morn diagnos gerd adopt pep black lab giv frittat recip goddamnit,1,1.69,1.0,0.1
161,162,tim fli tim wait man tim heal wind us want tim tim stand tim grow tim let go,0,,,0.0
162,163,boss say worst train driv ev many derail year say sur hard keep track,1,2.85,0.0,0.0
163,164,sou many subway hat underground railroad,1,2.05,1.0,1.9
164,165,switch friend fin sup mario odyssey lov play next,0,,,0.0
165,166,fat man stand front kindergart on teach com ask expect child bite fat,1,2.33,0.0,1.05
166,167,aunty red think ag gap lesb rel work girlfriend 20 year apart issu famy friend think crazy aunty red tweet tea,0,,,0.2
167,168,lov matthew macfayd success cury lik darcy prideand prejud today go watch cousin greg pandp mr bingley,0,,,0.0
168,169,hum mak mistak mean evil mean hum,0,,,0.1
169,170,interview deal high stress situ rememb hold on vibr pag giv resta most cry,1,2.0,1.0,0.15
170,171,many muslim wom tak screw light bulb sil muslim wom allow screw light bulb,1,1.55,0.0,3.35
171,172,head chinatown work hear erect day,1,1.79,0.0,2.3
172,173,get movy dog want paw oh surewait say paw dog lol oh god lmao,1,2.5,0.0,0.0
173,174,bird fli hous chimney calm walk front door lock goodby hous,1,1.72,0.0,0.2
174,175,get throw strip club last night us monopo money see pay real money see fak boob,1,3.25,1.0,0.85
175,176,want tel girlfriend us way much tee goe want hurt feel soft blow,1,3.0,1.0,0.5
176,177,blond throw grenad pul pin throw back,1,3.0,0.0,1.35
177,178,hear girl go fish three guy cam back red snap,1,1.79,1.0,2.0
178,179,tak piec heart mak apart nev alon shawn mend,0,,,0.0
179,180,mal hum tend produc sperm ejac intercours perceiv riv compet,0,,,0.1
180,181,mattel releas muslim barby blowup dol,1,2.58,0.0,3.55
181,182,stat new york help nra buy first off shoot ring 1872,0,,,0.0
182,183,rmscs 10 yr old elen harrison 200 breast fin fin strong 24357 today juny olymp bks juny olymp,0,,,0.0
183,184,tak cut pict child instagram writ inspir post good par ign child 45 min,1,2.33,0.0,0.05
184,185,multicult movy jaw common mad be desp gre whit,1,1.84,0.0,2.5
185,186,fedex jok act get tomorrow,1,3.21,0.0,0.0
186,187,someon tell condescend mean talk peopl,1,2.47,0.0,0.25
187,188,way go hel hand basket sound pleas,1,2.42,1.0,0.0
188,189,cannib wif say cam hom lat din giv cold should,1,2.5,0.0,0.0
189,190,stat say 1 3 peopl rel unfaith nee work wif girlfriend,1,2.9,0.0,0.5
190,191,right easy,0,,,0.0
191,192,long term dehydr lead wrinkl mak sur drink enough wat every day ev feel thirsty wat wrinkl heal,0,,,0.0
192,193,much wood would woodchuck chuck woodchuck crossfit guess,1,1.75,0.0,0.05
193,194,whenev get new follow try tweet someth real disappoint know,1,2.76,0.0,0.0
194,195,see pict mar rov lov mar rov watch episod planet ear lov david attenborough see dad person hey dud,1,2.38,0.0,0.0
195,196,fin watch evil geni sery netflix bruh might sleep tonight,0,,,0.0
196,197,three blond sit park bench eat ic cream con on suck on bite on lick on marry on wed ring sicko,1,1.95,0.0,0.6
197,198,green tea antioxid cal catechin help spee metabol fat burn diet,0,,,0.0
198,199,real laugh best sound ev hear tayl swift,0,,,0.0
199,200,know wear prem ejac club cam pant,1,2.65,1.0,1.0
200,201,com book plot ide catwom die uncontrol urg chas superm las vis,1,2.45,0.0,0.0
201,202,best part go 3d movy everyon the look lik roy orbison,1,2.05,1.0,0.3
202,203,sit wond spiderweb becom cob lik plato aristotl oth,1,1.31,1.0,0.0
203,204,profess osm densest mat ear 22 gram 1 cub centimet say profess nod thicc fuck,1,1.56,1.0,0.35
204,205,girl lik say lik bond eith on say,1,1.17,1.0,1.1
205,206,let us go city hal tomorrow want spend anoth day marry,0,,,0.0
206,207,believ part lov cho put poison dag mak happy end,0,,,0.05
207,208,cal someon cle vacc cle vacu cle,1,2.3,1.0,0.0
208,209,sometim everyth seem reach mat hard try tarz,0,,,0.0
209,210,think friend might gay dick tast lik shit,1,2.05,1.0,2.25
210,211,french chef giv wif valentin day hug littl quich,1,2.75,1.0,0.3
211,212,cal tal obes comput nerd blad control problem big fat geek wet,1,1.75,0.0,1.8
212,213,abc new bee fly mak honey fox islam insect attack texa cnn fly warbird cre liquid yellow weapon mass destruct,1,2.47,1.0,0.45
213,214,cal mosquito pak churchito,1,1.3,0.0,1.1
214,215,contain anym get control controol control,0,,,0.0
215,216,look girl brok smil maroon 5,0,,,0.0
216,217,play bagpip lik throw javelin blindfold good get peopl at,1,2.74,0.0,0.05
217,218,norway tak three year high educ becom pol off gradu award bachel degr pol study,0,,,0.0
218,219,valu promot instead defend,0,,,0.0
219,220,first dat lik bad boy try impress sometim reply reply email,1,2.47,1.0,0.0
220,221,two chees truck run de bri everywh,1,3.15,1.0,0.2
221,222,6 3 john krasinsk shortest broth on 6 8 6 9,0,,,0.0
222,223,get divorc arkansa stil sist,1,2.79,0.0,1.75
223,224,conclud run aw run surround peopl black mag black ment heal ask dr v,0,,,0.0
224,225,thinkhop hap favorit couplecharact last episod season 9 shar think,0,,,0.0
225,226,hum lik snak also hum mmmm eg,1,2.24,1.0,0.0
226,227,dark chocol stim endorphin brain bring feel pleas also contain serotonin act antidepress,0,,,0.0
227,228,deserv lov would giv someon els,0,,,0.0
228,229,bee stor inform longterm mem sleep lik hum dream,0,,,0.0
229,230,fak smil trick brain think happy act boost mood,0,,,0.0
230,231,yo mam lik sun look long go blind,1,1.72,0.0,0.85
231,232,word whit peopl cal whit peopl black peopl cal black peopl dad,1,1.5,0.0,3.55
232,233,golf get set golf club wif golf b good trad,1,2.74,0.0,0.3
233,234,70 kid stat juvenil facil ment illnessdisord let us stop crimin behavy caus heal issu,0,,,0.15
234,235,sex posit produc ugliest childr ask moth,1,2.25,0.0,1.7
235,236,think tru lov thing crush heart thing tak lif light destroy,0,,,0.05
236,237,anxy excess stress lead hair loss,0,,,0.0
237,238,elimin work fig import hold tight thing mat,0,,,0.0
238,239,think peopl tak hyph smiley look lik someon syndrom,1,1.11,0.0,4.05
239,240,stretch ur musc bed morn increas blood flow releas stress stretch musc giv bet post stretch,0,,,0.0
240,241,be mean friend ask anyth be mean,1,2.44,0.0,0.15
241,242,cal hil mex herb sillyantro,1,1.89,0.0,1.0
242,243,class song class car class dean cov greas drink warm coff lov class supern,0,,,0.0
243,244,diff caucas as cauc,1,2.15,0.0,1.7
244,245,cal irishm bount wal rick oshe,1,2.35,1.0,0.5
245,246,mick jag say guy hack dropbox account hey get cloud,1,2.63,1.0,0.0
246,247,beauty job cast crew tak bow greenleaf,0,,,0.0
247,248,sit feel tol sec guy,0,,,0.0
248,249,part world almost cut littl mermaid,0,,,0.0
249,250,fart consid comply comfort,1,1.94,0.0,0.2
250,251,nyc begin pilot program 2 help teen deal stress anxy fear shero black ment heal chiar de blasio front cent,0,,,0.65
251,252,get phon cal nam trend trol aw fak thing tru raid arrest sanit self dist rest world stay saf everybody,0,,,0.0
252,253,know say go black singl moth,1,2.05,1.0,3.35
253,254,weird com wittiest thing say show bad non guy show gym apprecy hum,1,2.42,1.0,0.3
254,255,two condom walk gay bar on say want go insid get shitfac,1,1.65,0.0,1.8
255,256,everyon retweet video send lov let dm,0,,,0.0
256,257,go extr mil nev crowd,0,,,0.0
257,258,shakespear pocahonta al tim,0,,,0.0
258,259,hey grandson nam germ man mak go crazy alzheim grandm alzheim,1,2.42,0.0,1.25
259,260,count pleas everyon foc pleas on count,0,,,0.0
260,261,ent world alon leav alon everyth hap ow find littl company,0,,,0.0
261,262,cal black man fly plan pilot,1,1.88,1.0,1.1
262,263,tel inv toothbrush west virgin anywh els would cal teethbrush,1,2.55,1.0,1.4
263,264,appl cid vineg good ton help clear scar acn mark acn scar,0,,,0.0
264,265,amput say mom learn rid bik look hand,1,2.45,0.0,1.85
265,266,punch femin today hit flo screech somebody cal cop word get men help,1,1.65,1.0,3.5
266,267,block gam throne twit account say root whit walk whit,1,2.06,1.0,1.25
267,268,plan destroy world war ii plan ear today,0,,,0.05
268,269,duck dynasty guy right bapt be guy iraq saf christians nev start war bullshit reason,1,2.5,1.0,2.0
269,270,accid put wallet freez last night good job real nee cold hard cash,1,2.45,0.0,0.0
270,271,cal ethiop dog stupid,1,1.0,0.0,3.2
271,272,drink day begin tuesday thursday today tomorrow,1,2.85,0.0,0.0
272,273,10 men mak heav go would hel,1,2.7,1.0,0.9
273,274,av be consum 35 pound chees every year,0,,,0.0
274,275,muslim wif leave day guess know jihad,1,2.1,1.0,2.35
275,276,real chang involv loss pow anand giridharada,0,,,0.0
276,277,googl start wildfir get 48500 match,1,2.79,0.0,0.45
277,278,new girlfriend tell terr bed tell unfair mak judg less minut,1,3.05,1.0,0.1
278,279,self pra lead self destruct,0,,,0.0
279,280,wif gav bir ging baby shav head tell everyon cant,1,1.65,0.0,2.9
280,281,want op gay pok bar cal spac aid,1,1.75,0.0,3.25
281,282,texa man go er blood alcohol level 037 drink peopl suspect closet drink year oft becam unexpect drink doct find autobrewery syndrom get drink whenev at carb,0,,,0.15
282,283,gay man nee che lead friend duty che ev bad cho gay man nee mean friend keep toe mak risky bad cho,0,,,0.65
283,284,instead murdersuicid contempl rar suicidemurd whereby jump high window land girlfriend,1,2.37,1.0,1.3
284,285,cal mex guy on rub toe roberto,1,1.83,0.0,1.25
285,286,green tea antiinflam property protect cel membr reduc risk dam ultraviolet light skin heal,0,,,0.25
286,287,origin big bird retir sesam street tell delicy,1,2.0,0.0,0.45
287,288,blond sor bellybutton blond boyfriend,1,1.75,1.0,1.7
288,289,branch unit stat milit patriot air forc us af,1,2.53,1.0,0.4
289,290,angel demon drink togeth wtf bad ide suck sandwich,1,1.18,1.0,0.5
290,291,many peopl day judg tel look,1,2.82,1.0,0.1
291,292,know breath keep breath,0,,,0.0
292,293,worst pub ev cal fiddl vil in,1,2.67,1.0,0.1
293,294,girlfriend prom anyth weird ok lat fun tun sharon mmmmy condol,1,1.95,1.0,0.5
294,295,fath tell son afric nt be afr americ nt kid black fath,1,2.39,1.0,3.45
295,296,choos pap towel instead hand dry right tre walk bathroom,1,2.05,0.0,0.05
296,297,meet vap vampir roman cal vlad inh,1,2.05,0.0,0.0
297,298,ment heal young black men grow concern on way reach reach world list mus togeth,0,,,0.0
298,299,fig contest ms americ pag prostitut look on sash say da ho,1,2.1,1.0,2.2
299,300,iphon autocorrect word nigg nigg lik who iphon go around yel n word jes,1,2.16,1.0,2.95
300,301,cool nic peopl,0,,,0.0
301,302,get rid fat ghost exorc,1,2.65,0.0,0.5
302,303,46 hour mak chair every day genius thank bil corso work hard transform,0,,,0.0
303,304,10 guy alway mak sur happy first happy happy,0,,,0.25
304,305,wil forc pow put resourc back black commun challeng naesm2016,0,,,0.0
305,306,end peopl judg anyway liv lif impress oth liv lif impress,0,,,0.0
306,307,sid skylin split two mil away see ed she,0,,,0.0
307,308,understand wom want eq could bet show lack ambit wond pay less,1,1.67,0.0,2.8
308,309,lik be spel lik col lik neighb real lik col neighb,1,1.76,0.0,3.75
309,310,get on kne middl busy resta pul ring whol plac tear marry put back grenad,1,2.45,0.0,0.65
310,311,go visit bangkok say phuket rofl,1,2.55,1.0,0.8
311,312,get bet girl rel alway tough first anyth wor wor work stay cours,0,,,0.0
312,313,cal argu two veg plantbas beef,1,2.35,0.0,0.25
313,314,singl sign strong enough wait deserv,0,,,0.0
314,315,cal constip detect shit sherlock,1,2.75,0.0,0.15
315,316,alon bet ind publ,0,,,0.0
316,317,nev underestim pow big heart piglet,0,,,0.0
317,318,see spac man park car man,1,1.71,1.0,0.0
318,319,nebrask design koolaid off stat soft drink 1998,0,,,0.15
319,320,dildo selfy stick common cunt end,1,2.3,1.0,2.85
320,321,henry redcliff,0,,,0.0
321,322,fif in astro dodg leave ear beat traff,1,1.94,0.0,0.0
322,323,welcom forty eyebrow bushy enough see without us mir,1,2.06,1.0,0.15
323,324,get wif someth spec annivers look down syndrom cousin go pub mat,1,1.89,1.0,3.85
324,325,sery quest dark web norm on switch plac,1,1.76,0.0,0.0
325,326,deadtom 2,0,,,0.25
326,327,bathroom law interest on ban loud sigh,1,1.78,0.0,0.45
327,328,young dea noth rum old prom expect,0,,,0.4
328,329,wif refus fry food insist eat healthy turn kitch naz keep stick everyth ov,1,1.61,0.0,2.65
329,330,fart pack elev wrong many level,1,2.82,1.0,0.1
330,331,travel intern mem visit aunty red tweet tea,0,,,0.0
331,332,prevy episod steph erdm talk approach wom day learn daytim best tim approach refram assocy cold approach start convers align already think,0,,,0.4
332,333,us pur alo ver gel pret shampoo help reliev itch dandruff dandruff hair,0,,,0.05
333,334,okay go showtim,0,,,0.0
334,335,real noth lik hop real end day oft turn insid upsid,0,,,0.0
